Name,Rating,Reviews,Address,Website,Phone,Email,关键词,区域,抓取时间
NRY Architects,,,"地址: 15th Floor, Menara Teo Chew, 1, Jalan Lumut, 50400 Kuala Lumpur, 马来西亚 ",http://www.nry.com.my/,电话: +60 3-4043 1348 ,,Architectural Interior Design Firm,"Kuala Lumpur, Kuala Lumpur, Malaysia",2026-05-09 09:58
Doubble Interior Associates Malaysia,,,"地址: No.2-28, Residence Park Bukit Jalil, Bukit Jalil, 57000 Kuala Lumpur, 马来西亚 ",http://www.doubble.group/my,电话: +60 3-9765 3861 ,"enquiry@doubble.my, enquiry@doubble.sg",Architectural Interior Design Firm,"Kuala Lumpur, Kuala Lumpur, Malaysia",2026-05-09 09:58
Blaine Robert Design,,,"地址: 42-1, Jalan Doraisamy, Chow Kit, 50300 Kuala Lumpur, Wilayah Persekutuan Kuala Lumpur, 马来西亚 ",https://www.blainerobertdesign.com/,电话: +60 13-319 3991 ,,Architectural Interior Design Firm,"Kuala Lumpur, Kuala Lumpur, Malaysia",2026-05-09 09:59
NR Design Group,,,"地址: L-2-12, Plaza Damas, 60, Jalan Sri Hartamas 1, Taman Sri Hartamas, 50480 Kuala Lumpur, Wilayah Persekutuan Kuala Lumpur, 马来西亚 ",https://nrdesign.my/,电话: +60 3-6201 4860 ,group@nrdesign.my,Architectural Interior Design Firm,"Kuala Lumpur, Kuala Lumpur, Malaysia",2026-05-09 09:59
Edge ID - Top Interior designer and renovation company,,,"地址: 36-2, K.L, 36-2, Jalan Pandan Prima 2, Dataran Pandan Prima, 55100 Kuala Lumpur, Selangor, 马来西亚 ",http://edgeid.com.my/,电话: +60 12-311 1344 ,hello@edgeid.com.my,Architectural Interior Design Firm,"Kuala Lumpur, Kuala Lumpur, Malaysia",2026-05-09 09:59
Santa Fe Interior Architecture Sdn Bhd,,,"地址: 12, Persiaran Bukit Melawati 2, Taman Bukit Melawati, 53100 Kuala Lumpur, Selangor, 马来西亚 ",http://www.santafeia.com/,电话: +60 12-838 9982 ,,Architectural Interior Design Firm,"Kuala Lumpur, Kuala Lumpur, Malaysia",2026-05-09 10:00
Joey Houz Design - Top Interior Design Malaysia KL,,,"地址: 6, Jalan Kia Peng, Kuala Lumpur, 50450 Kuala Lumpur, Wilayah Persekutuan Kuala Lumpur, 马来西亚 ",https://www.houz.com.my/?utm_source=GBP&utm_medium=organic&utm_campaign=office,电话: +60 12-591 4689 ,"hello@houz.com.my, askme@houz.com.my",Architectural Interior Design Firm,"Kuala Lumpur, Kuala Lumpur, Malaysia",2026-05-09 10:00
Stay Space,,,"地址: Block D-3, 3, Jalan Jalil Utama 2, Bukit Jalil, 57000 Kuala Lumpur, Federal Territory of Kuala Lumpur, 马来西亚 ",http://www.stayspace.com.my/,电话: +60 12-332 5729 ,hi.stayspace@gmail.com,Architectural Interior Design Firm,"Kuala Lumpur, Kuala Lumpur, Malaysia",2026-05-09 10:00
Steven Leach Group - Kuala Lumpur,,,"地址: 01-01, Crown Regency, 12, Jalan P. Ramlee, Kuala Lumpur, 50250 Kuala Lumpur, Wilayah Persekutuan, 马来西亚 ",https://www.sla-group.com/,电话: +60 3-2161 1032 ,,Architectural Interior Design Firm,"Kuala Lumpur, Kuala Lumpur, Malaysia",2026-05-09 10:00
