Name,Rating,Reviews,Address,Website,Phone,Email,关键词,区域,抓取时间
Doubble Interior Associates Malaysia,,,"地址: No.2-28, Residence Park Bukit Jalil, Bukit Jalil, 57000 Kuala Lumpur, 马来西亚 ",http://www.doubble.group/my,电话: +60 3-9765 3861 ,"enquiry@doubble.my, enquiry@doubble.sg",Architectural Interior Design,"Kuala Lumpur, Kuala Lumpur, Malaysia",2026-05-09 10:34
Edge ID - Top Interior designer and renovation company,,,"地址: 36-2, K.L, 36-2, Jalan Pandan Prima 2, Dataran Pandan Prima, 55100 Kuala Lumpur, Selangor, 马来西亚 ",http://edgeid.com.my/,电话: +60 12-311 1344 ,,Architectural Interior Design,"Kuala Lumpur, Kuala Lumpur, Malaysia",2026-05-09 10:35
Blaine Robert Design,,,"地址: 42-1, Jalan Doraisamy, Chow Kit, 50300 Kuala Lumpur, Wilayah Persekutuan Kuala Lumpur, 马来西亚 ",https://www.blainerobertdesign.com/,电话: +60 13-319 3991 ,,Architectural Interior Design,"Kuala Lumpur, Kuala Lumpur, Malaysia",2026-05-09 10:35
Joey Houz Design - Top Interior Design Malaysia KL,,,"地址: 6, Jalan Kia Peng, Kuala Lumpur, 50450 Kuala Lumpur, Wilayah Persekutuan Kuala Lumpur, 马来西亚 ",https://www.houz.com.my/?utm_source=GBP&utm_medium=organic&utm_campaign=office,电话: +60 12-591 4689 ,"hello@houz.com.my, askme@houz.com.my",Architectural Interior Design,"Kuala Lumpur, Kuala Lumpur, Malaysia",2026-05-09 10:35
Stay Space,,,"地址: Block D-3, 3, Jalan Jalil Utama 2, Bukit Jalil, 57000 Kuala Lumpur, Federal Territory of Kuala Lumpur, 马来西亚 ",http://www.stayspace.com.my/,电话: +60 12-332 5729 ,hi.stayspace@gmail.com,Architectural Interior Design,"Kuala Lumpur, Kuala Lumpur, Malaysia",2026-05-09 10:35
NR Design Group,,,"地址: L-2-12, Plaza Damas, 60, Jalan Sri Hartamas 1, Taman Sri Hartamas, 50480 Kuala Lumpur, Wilayah Persekutuan Kuala Lumpur, 马来西亚 ",https://nrdesign.my/,电话: +60 3-6201 4860 ,group@nrdesign.my,Architectural Interior Design,"Kuala Lumpur, Kuala Lumpur, Malaysia",2026-05-09 10:36
Padu Design Ally Sdn Bhd,,,"地址: B-19-3A, Pavilion Embassy, Jln Ampang, Kampung Datuk Keramat, 50450 Kuala Lumpur, Wilayah Persekutuan Kuala Lumpur, 马来西亚 ",https://padudesign.com/,电话: +60 18-288 1618 ,,Architectural Interior Design,"Kuala Lumpur, Kuala Lumpur, Malaysia",2026-05-09 10:36
Santa Fe Interior Architecture Sdn Bhd,,,"地址: 12, Persiaran Bukit Melawati 2, Taman Bukit Melawati, 53100 Kuala Lumpur, Selangor, 马来西亚 ",http://www.santafeia.com/,电话: +60 12-838 9982 ,,Architectural Interior Design,"Kuala Lumpur, Kuala Lumpur, Malaysia",2026-05-09 10:36
Refine Design Atelier I Architecture & Interior Design Kuala Lumpur & Selangor,,,"地址: B-13A-9, Taman, Melati Utama, 53100 Kuala Lumpur, Wilayah Persekutuan Kuala Lumpur, 马来西亚 ",https://refinedesignatelier.com/,电话: +60 16-410 3130 ,refinedesignatelier20@gmail.com,Architectural Interior Design,"Kuala Lumpur, Kuala Lumpur, Malaysia",2026-05-09 10:37
