Name,Rating,Reviews,Address,Website,Phone,Email,关键词,区域,抓取时间
Tick Hong Hardware & Timber Sdn Bhd,,,"地址: LOT 926, Jalan Sungai Besi, Lebuhraya Sungai Besi, 57100 Kuala Lumpur, 马来西亚 ",http://www.aurous.com.my/,电话: +60 3-9057 2103 ,,Architectural Hardware,"Kuala Lumpur, Kuala Lumpur, Malaysia",2026-05-09 10:24
Hialee Hardware Sdn Bhd,,,"地址: 327, Jalan Pahang, Setapak, 53000 Kuala Lumpur, Wilayah Persekutuan Kuala Lumpur, 马来西亚 ",,电话: +60 3-4022 1188 ,,Architectural Hardware,"Kuala Lumpur, Kuala Lumpur, Malaysia",2026-05-09 10:25
Cheng Huat Hardware (Sentul) Sdn Bhd,,,"地址: 504, Jalan Sentul, Kampung Chubadak Tambahan Kawasan E, 51100, Kuala Lumpur, WP Kuala Lumpur, 51000马来西亚 ",https://www.chenghuatgroup.com.my/,电话: +60 11-6331 6838 ,,Architectural Hardware,"Kuala Lumpur, Kuala Lumpur, Malaysia",2026-05-09 10:25
Kampung Baru Hardware Sdn Bhd,,,"地址: 49, Jalan Raja Muda Abdul Aziz, Chow Kit, 50300 Kuala Lumpur, Wilayah Persekutuan Kuala Lumpur, 马来西亚 ",https://www.kampungbaruhardware.com.my/,电话: +60 3-2697 7988 ,"kampungbaruhardwaresd88@gmail.com, 605a7baede844d278b89dc95ae0a9123@sentry-next.wixpress.com, 8eb368c655b84e029ed79ad7a5c1718e@sentry.wixpress.com",Architectural Hardware,"Kuala Lumpur, Kuala Lumpur, Malaysia",2026-05-09 10:25
BAAGUS HARDWARE,,,"地址: 41, Jalan Raja Muda Abdul Aziz, Chow Kit, 50300 Kuala Lumpur, Wilayah Persekutuan Kuala Lumpur, 马来西亚 ",,电话: +60 17-752 7552 ,,Architectural Hardware,"Kuala Lumpur, Kuala Lumpur, Malaysia",2026-05-09 10:25
Syarikat Standard Hardware Supply,,,"地址: 41, Jalan Raja Muda Abdul Aziz, Chow Kit, 50300 Kuala Lumpur, Wilayah Persekutuan Kuala Lumpur, 马来西亚 ",,电话: +60 17-752 7552 ,,Architectural Hardware,"Kuala Lumpur, Kuala Lumpur, Malaysia",2026-05-09 10:25
