Name,Rating,Reviews,Address,Website,Phone,Email,关键词,区域,抓取时间
宜家城,,,"地址: 232 & 234, Jln Sultan Azlan Shah, 51200 Kuala Lumpur, Wilayah Persekutuan Kuala Lumpur, 马来西亚 ",http://htrendskb.com.my/,电话: +60 3-4045 8680 ,htrendskitchenbath@gmail.com,Bathroom Exhaust Fan Supplier,"Kuala Lumpur, Kuala Lumpur, Malaysia",2026-05-09 10:25
Mandi B.P Sdn Bhd,,,"地址: 1, Jalan Pinggir 2 ½ Miles, Jalan Ipoh, 51200 Kuala Lumpur, Wilayah Persekutuan Kuala Lumpur, 马来西亚 ",http://mandibp.com/,电话: +60 3-4043 8833 ,,Bathroom Exhaust Fan Supplier,"Kuala Lumpur, Kuala Lumpur, Malaysia",2026-05-09 10:25
d'looma Jalan Ipoh KL (Dilooma Sdn. Bhd.),,,"地址: No. 238 & 240, Batu 2, Jln Sultan Azlan Shah, Jalan Ipoh, 51200 Kuala Lumpur, Federal Territory of Kuala Lumpur, 马来西亚 ",http://www.dlooma.com.my/,电话: +60 3-4045 5980 ,,Bathroom Exhaust Fan Supplier,"Kuala Lumpur, Kuala Lumpur, Malaysia",2026-05-09 10:25
"Ming Lighting (Jinjang, Kepong)",,,"地址: No.2 (Block A), Jalan 3/32A, Off Batu 6½, Jalan Kepong, Kepong, 52100 Kuala Lumpur, 马来西亚 ",http://minglighting.com.my/,电话: +60 10-862 3671 ,,Bathroom Exhaust Fan Supplier,"Kuala Lumpur, Kuala Lumpur, Malaysia",2026-05-09 10:26
Big Bath (KL),,,"地址: 16, Jalan Metro Pudu, Off, Jln Yew, Fraser Business Park, 55200 Kuala Lumpur, Wilayah Persekutuan Kuala Lumpur, 马来西亚 ",https://www.bigbath.com.my/?utm_source=GBP&utm_medium=GBP&utm_campaign=GBP,电话: +60 19-228 6912 ,sales@bigbath.com.my,Bathroom Exhaust Fan Supplier,"Kuala Lumpur, Kuala Lumpur, Malaysia",2026-05-09 10:26
Kuan Hoi Trading Sdn. Bhd.,,,"地址: A55 & A56, Jln Tuanku 1, Taman Salak Selatan, 57100 Kuala Lumpur, Federal Territory of Kuala Lumpur, 马来西亚 ",http://www.kuanhoi.com.my/,电话: +60 13-328 9292 ,sales@kuanhoi.com.my,Bathroom Exhaust Fan Supplier,"Kuala Lumpur, Kuala Lumpur, Malaysia",2026-05-09 10:26
