Name,Rating,Reviews,Address,Website,Phone,Email,关键词,区域,抓取时间
Building Materials Online,,,"地址: Lot 2-2, Level 2, Tower B The Troika, 19, Persiaran KLCC, Kuala Lumpur, 50450 Kuala Lumpur, 马来西亚 ",https://buildingmaterials.com.my/,电话: +60 17-660 3557 ,info@buildingmaterials.com.my,Construction Materials Supplier,"Kuala Lumpur, Kuala Lumpur, Malaysia",2026-05-09 10:08
Ezi Maju Sdn. Bhd. (Building Material Malaysia),,,"地址: W.P, 3-64, JALAN UDANG RAWA ,TAMAN SRI SEGAMBUT, Segambut, 52100 Kuala Lumpur, 马来西亚 ",https://ezimaju.com.my/,电话: +60 12-590 0783 ,ezimaju.official@gmail.com,Construction Materials Supplier,"Kuala Lumpur, Kuala Lumpur, Malaysia",2026-05-09 10:08
Builtory,,,"地址: B-11-3, Northpoint Offices, 1, Medan Syed Putra Utara, Mid Valley City, 59200 Kuala Lumpur, Federal Territory of Kuala Lumpur, 马来西亚 ",https://builtory.my/,电话: +60 11-1165 8588 ,info@builtory.my,Construction Materials Supplier,"Kuala Lumpur, Kuala Lumpur, Malaysia",2026-05-09 10:09
Aathaworld Sdn Bhd,,,"地址: B-11-3, Northpoint Offices, 1, Medan Syed Putra Utara, Mid Valley City, 59200 Kuala Lumpur, Federal Territory of Kuala Lumpur, 马来西亚 ",http://www.aathaworld.com/,电话: +60 11-7001 1003 ,"cd64ba1f47df485bba2b0076c0dd3b25@sentry.wixpress.com, dd0a55ccb8124b9c9d938e3acf41f8aa@sentry.wixpress.com, 5d1795a2db124a268f1e1bd88f503500@sentry.wixpress.com",Construction Materials Supplier,"Kuala Lumpur, Kuala Lumpur, Malaysia",2026-05-09 10:09
Hanson Building Materials Malaysia (Sg Besi),,,"地址: 122, Jalan Emas, Chan Sow Lin, 55200 Kuala Lumpur, Wilayah Persekutuan Kuala Lumpur, 马来西亚 ",http://www.hanson.my/,电话: +60 3-9222 8927 ,,Construction Materials Supplier,"Kuala Lumpur, Kuala Lumpur, Malaysia",2026-05-09 10:09
Signature Building Material Sdn Bhd 新利腾五金建材供应有限公司,,,"地址: NO 20-G , 20-1 & 20-2 ,JALAN SET 3/1 SETIA ECO, Templer Park, 48000 Rawang, Selangor, 马来西亚 ",https://www.signaturebuildingmaterial.com.my/,电话: +60 16-358 6663 ,,Construction Materials Supplier,"Kuala Lumpur, Kuala Lumpur, Malaysia",2026-05-09 10:09
