Name,Rating,Reviews,Address,Website,Phone,Email,关键词,区域,抓取时间
Aathaworld Sdn Bhd,,,"地址: B-11-3, Northpoint Offices, 1, Medan Syed Putra Utara, Mid Valley City, 59200 Kuala Lumpur, Federal Territory of Kuala Lumpur, 马来西亚 ",http://www.aathaworld.com/,电话: +60 11-7001 1003 ,"cd64ba1f47df485bba2b0076c0dd3b25@sentry.wixpress.com, dd0a55ccb8124b9c9d938e3acf41f8aa@sentry.wixpress.com, 5d1795a2db124a268f1e1bd88f503500@sentry.wixpress.com",Design & Build Contractor,"Kuala Lumpur, Kuala Lumpur, Malaysia",2026-05-09 09:36
Square Design & Build Sdn Bhd,,,"地址: A-1-18, Razak City Residence Kuala Lumpur, 57100 Sungai Besi, Wilayah Persekutuan Kuala Lumpur, 马来西亚 ",http://www.squaredesign.co/,电话: +60 18-381 0313 ,info@squaredesign.co,Design & Build Contractor,"Kuala Lumpur, Kuala Lumpur, Malaysia",2026-05-09 09:36
PMJ Design & Build Sdn Bhd,,,"地址: NO.3-43A, PV128, Jalan Genting Kelang, Danau Kota, 53300 Kuala Lumpur, Federal Territory of Kuala Lumpur, 马来西亚 ",http://www.pmjrenodesign.com/,电话: +60 16-425 7487 ,sales@pmjrenodesign.com,Design & Build Contractor,"Kuala Lumpur, Kuala Lumpur, Malaysia",2026-05-09 09:36
RETROBEE DESIGN & BUILD SDN BHD (Office Renovation Contractor KL),,,"地址: 11-1, Jln Damai Raya 6, Alam Damai, 56000 Kuala Lumpur, Wilayah Persekutuan Kuala Lumpur, 马来西亚 ",https://retrobeedesign.com/office-design-and-build-contractor-malaysia/,电话: +60 3-9107 3938 ,sales@retrobeedesign.com,Design & Build Contractor,"Kuala Lumpur, Kuala Lumpur, Malaysia",2026-05-09 09:37
AW Builders Malaysia | Workshop,,,"地址: AW Builders Malaysia, Jalan 13/56, Ampang Ulu Kelang Ampang, 54200 Kuala Lumpur, Wilayah Persekutuan Kuala Lumpur, 马来西亚 ",http://www.awbuildersmalaysia.biz/,电话: +60 17-556 9502 ,"dd0a55ccb8124b9c9d938e3acf41f8aa@sentry.wixpress.com, 271e9fa3230b4eec94b02bf95780f5f2@sentry.wixpress.com, 9a65e97ebe8141fca0c4fd686f70996b@sentry.wixpress.com",Design & Build Contractor,"Kuala Lumpur, Kuala Lumpur, Malaysia",2026-05-09 09:37
Geometry Design and Build Group Sdn Bhd,,,"地址: B-3A-5, Seri Gembira Avenue, 6, Jalan Senang Ria, Taman Gembira, 58200 Kuala Lumpur, Wilayah Persekutuan Kuala Lumpur, 马来西亚 ",https://geometrydnb.com/,电话: +60 17-443 8675 ,geometry.db@gmail.com,Design & Build Contractor,"Kuala Lumpur, Kuala Lumpur, Malaysia",2026-05-09 09:37
MIL Design And Construction,,,"地址: 1, wisma lensa Jalan kasah , medan damansara, Bukit Damansara, 50490 Kuala Lumpur, Wilayah Persekutuan Kuala Lumpur, 马来西亚 ",http://www.mildesign.com.my/,电话: +60 19-267 3117 ,"info.mildesign@gmail.com, bfb679c754744c58a7374ee6e25cfc13@sentry.wixpress.com, 605a7baede844d278b89dc95ae0a9123@sentry-next.wixpress.com",Design & Build Contractor,"Kuala Lumpur, Kuala Lumpur, Malaysia",2026-05-09 09:37
Edge ID - Top Interior designer and renovation company,,,"地址: 36-2, K.L, 36-2, Jalan Pandan Prima 2, Dataran Pandan Prima, 55100 Kuala Lumpur, Selangor, 马来西亚 ",http://edgeid.com.my/,电话: +60 12-311 1344 ,,Design & Build Contractor,"Kuala Lumpur, Kuala Lumpur, Malaysia",2026-05-09 09:38
ADS DESIGN BUILD,,,"地址: Jalan Wangsa Delima 5 Pusat Bandar Wangsa Maju 75-1 Kuala Lumpur MY, Wangsa Maju, 53300 W, Federal Territory of Kuala Lumpur, 马来西亚 ",https://www.adsgroupdesign.com/,电话: +60 10-398 8021 ,,Design & Build Contractor,"Kuala Lumpur, Kuala Lumpur, Malaysia",2026-05-09 09:38
