Name,Rating,Reviews,Address,Website,Phone,Email,关键词,区域,抓取时间
Bina Warehouse Kitchen Gallery (SieMatic Flagship) KL,,,"地址: 22, Jalan Kampung Attap, Kampung Attap, 50460 Kuala Lumpur, Wilayah Persekutuan Kuala Lumpur, 马来西亚 ",https://www.binawarehouse.com/,电话: +60 3-2274 6111 ,"271e9fa3230b4eec94b02bf95780f5f2@sentry.wixpress.com, 9a65e97ebe8141fca0c4fd686f70996b@sentry.wixpress.com, ed436f5053144538958ad06a5005e99a@sentry.wixpress.com",Elegant Bath Cabinet Gallery,"Kuala Lumpur, Kuala Lumpur, Malaysia",2026-05-09 09:49
KBO厨具浴室用品,,,"地址: No. 39G, Jalan Tpk 2/8, Taman Perindustrian Kinrara, 47180 Puchong, Selangor, 马来西亚 ",https://kbomy.com/,电话: +60 3-8079 1268 ,,Elegant Bath Cabinet Gallery,"Kuala Lumpur, Kuala Lumpur, Malaysia",2026-05-09 09:49
Bina Warehouse (Bathroom & Kitchen) PJ,,,"地址: 7a, Jalan 51/215, Seksyen 51, 46050 Petaling Jaya, Selangor, 马来西亚 ",https://www.binawarehouse.com/,电话: +60 3-7781 5269 ,"271e9fa3230b4eec94b02bf95780f5f2@sentry.wixpress.com, 9a65e97ebe8141fca0c4fd686f70996b@sentry.wixpress.com, ed436f5053144538958ad06a5005e99a@sentry.wixpress.com",Elegant Bath Cabinet Gallery,"Kuala Lumpur, Kuala Lumpur, Malaysia",2026-05-09 09:49
View In Cabinet Design Sdn Bhd,,,"地址: No 12, 14, Jalan 9/155, Bukit Jalil Light Integrated Business Park, 58200 Kuala Lumpur, Wilayah Persekutuan Kuala Lumpur, 马来西亚 ",http://viewincabinet.com/,电话: +60 12-621 3283 ,,Elegant Bath Cabinet Gallery,"Kuala Lumpur, Kuala Lumpur, Malaysia",2026-05-09 09:49
Mandi B.P Sdn Bhd,,,"地址: 1, Jalan Pinggir 2 ½ Miles, Jalan Ipoh, 51200 Kuala Lumpur, Wilayah Persekutuan Kuala Lumpur, 马来西亚 ",http://mandibp.com/,电话: +60 3-4043 8833 ,,Elegant Bath Cabinet Gallery,"Kuala Lumpur, Kuala Lumpur, Malaysia",2026-05-09 09:50
Shower Scene (M) Sdn. Bhd.,,,"地址: 1, Jalan Pinggir 2 ½ Miles, Jalan Ipoh, 51200 Kuala Lumpur, Wilayah Persekutuan Kuala Lumpur, 马来西亚 ",http://mandibp.com/,电话: +60 3-4043 8833 ,,Elegant Bath Cabinet Gallery,"Kuala Lumpur, Kuala Lumpur, Malaysia",2026-05-09 09:50
