Name,Rating,Reviews,Address,Website,Phone,Email,关键词,区域,抓取时间
Sanuk Care Centre,,,"地址: 3, Jalan 17/52, Seksyen 17, 46400 Petaling Jaya, Selangor, 马来西亚 ",,,,Integrated Living Solutions,"Kuala Lumpur, Kuala Lumpur, Malaysia",2026-05-09 10:29
Secure Living Solutions (m) sdn bhd,,,"地址: GF-08, KOMPLEKS EMARTS, Jalan Pasar, Pudu, 55100 Kuala Lumpur, Federal Territory of Kuala Lumpur, 马来西亚 ",,电话: +60 3-9226 2822 ,,Integrated Living Solutions,"Kuala Lumpur, Kuala Lumpur, Malaysia",2026-05-09 10:29
Integrated Rehabilitation & Wellness Centre,,,"地址: 86G, Jalan Jalil 1, The Earth Bukit Jalil, Lebuhraya Puchong-Sg Besi, Bukit Jalil, 57000 Kuala Lumpur, Wilayah Persekutuan Kuala Lumpur, 马来西亚 ",https://zh.interehab.com/,电话: +60 13-583 8188 ,integrehabwellness@gmail.com,Integrated Living Solutions,"Kuala Lumpur, Kuala Lumpur, Malaysia",2026-05-09 10:29
Integrated Solution Provider Sdn Bhd,,,"地址: C-6-12, Condo Park Avenue, Jln PJU 10/1, Damansara Damai, 47830 Petaling Jaya, Selangor, 马来西亚 ",,电话: +60 3-6250 2505 ,,Integrated Living Solutions,"Kuala Lumpur, Kuala Lumpur, Malaysia",2026-05-09 10:29
Integrated Logistics Solutions Sdn Bhd,,,"地址: Lot & 11741, Persiaran Subang Indah, Taman Perindustrian Subang, 47500 Subang Jaya, Selangor, 马来西亚 ",http://integrated.my/index.php,电话: +60 3-5621 8888 ,norazila@integrated.my,Integrated Living Solutions,"Kuala Lumpur, Kuala Lumpur, Malaysia",2026-05-09 10:30
Malaysia Independent Living Association For Disabled (MILAD),,,"地址: 33, Jalan SS 3/14, Taman Universiti, 47300 Petaling Jaya, Selangor, 马来西亚 ",http://www.miladmalaysia.org/,电话: +60 13-397 3386 ,"271e9fa3230b4eec94b02bf95780f5f2@sentry.wixpress.com, 9a65e97ebe8141fca0c4fd686f70996b@sentry.wixpress.com, ed436f5053144538958ad06a5005e99a@sentry.wixpress.com",Integrated Living Solutions,"Kuala Lumpur, Kuala Lumpur, Malaysia",2026-05-09 10:30
ReU Living (Post Surgery and Recovery Care Centre),,,"地址: Micasa All Suite Hotel, 368B, Jln Tun Razak, Taman U Thant, 50400 Kuala Lumpur, Wilayah Persekutuan Kuala Lumpur, 马来西亚 ",http://reuliving.com/,电话: +60 10-380 0938 ,,Integrated Living Solutions,"Kuala Lumpur, Kuala Lumpur, Malaysia",2026-05-09 10:30
Smart Living Solution (M) Sdn Bhd,,,"地址: 20-31-A, Menara Mutiara Central, Jalan Desa Aman 1, Cheras, 56000 Kuala Lumpur, Wilayah Persekutuan Kuala Lumpur, 马来西亚 ",,电话: +60 10-309 1548 ,,Integrated Living Solutions,"Kuala Lumpur, Kuala Lumpur, Malaysia",2026-05-09 10:30
The living Clinic (Bangsar),,,"地址: 160, Jalan Maarof, Bangsar, 59100 Kuala Lumpur, Wilayah Persekutuan Kuala Lumpur, 马来西亚 ",https://www.thelivingcenters.com/,电话: +60 11-5425 5338 ,user@domain.com,Integrated Living Solutions,"Kuala Lumpur, Kuala Lumpur, Malaysia",2026-05-09 10:30
