Name,Rating,Reviews,Address,Website,Phone,Email,关键词,区域,抓取时间
Big Bath (KL),,,"地址: 16, Jalan Metro Pudu, Off, Jln Yew, Fraser Business Park, 55200 Kuala Lumpur, Wilayah Persekutuan Kuala Lumpur, 马来西亚 ",https://www.bigbath.com.my/?utm_source=GBP&utm_medium=GBP&utm_campaign=GBP,电话: +60 19-228 6912 ,sales@bigbath.com.my,Kitchen and bath supplier,"Kuala Lumpur, Kuala Lumpur, Malaysia",2026-05-09 09:55
宜家城,,,"地址: 232 & 234, Jln Sultan Azlan Shah, 51200 Kuala Lumpur, Wilayah Persekutuan Kuala Lumpur, 马来西亚 ",http://htrendskb.com.my/,电话: +60 3-4045 8680 ,,Kitchen and bath supplier,"Kuala Lumpur, Kuala Lumpur, Malaysia",2026-05-09 09:55
艾迪尔有限公司怡保路分店,,,"地址: 258A & B, 2 1/2 Miles Jalan Sultan Azlan Shah (Jalan Ipoh), Jalan Ipoh, 51200 Kuala Lumpur, Federal Territory of Kuala Lumpur, 马来西亚 ",http://www.topidea.com.my/,电话: +60 16-213 0507 ,info@topidea.com.my,Kitchen and bath supplier,"Kuala Lumpur, Kuala Lumpur, Malaysia",2026-05-09 09:56
KBO Kuche Bath Outlet (Kuchai Lama),,,"地址: G-7 & G-8, Dataran Loka, 9, Jalan Kuchai Lama, Taman Continental, 58200 Kuala Lumpur, Federal Territory of Kuala Lumpur, 马来西亚 ",http://www.kbomy.com/,电话: +60 19-981 6881 ,,Kitchen and bath supplier,"Kuala Lumpur, Kuala Lumpur, Malaysia",2026-05-09 09:56
d'looma Jalan Ipoh KL (Dilooma Sdn. Bhd.),,,"地址: No. 238 & 240, Batu 2, Jln Sultan Azlan Shah, Jalan Ipoh, 51200 Kuala Lumpur, Federal Territory of Kuala Lumpur, 马来西亚 ",http://www.dlooma.com.my/,电话: +60 3-4045 5980 ,shop@dlooma.com.my,Kitchen and bath supplier,"Kuala Lumpur, Kuala Lumpur, Malaysia",2026-05-09 09:56
Mandi B.P Sdn Bhd,,,"地址: No. 238 & 240, Batu 2, Jln Sultan Azlan Shah, Jalan Ipoh, 51200 Kuala Lumpur, Federal Territory of Kuala Lumpur, 马来西亚 ",http://www.dlooma.com.my/,电话: +60 3-4045 5980 ,,Kitchen and bath supplier,"Kuala Lumpur, Kuala Lumpur, Malaysia",2026-05-09 09:57
