Name,Rating,Reviews,Address,Website,Phone,Email,关键词,区域,抓取时间
Bina Warehouse Kitchen Gallery (SieMatic Flagship) KL,,,"地址: 22, Jalan Kampung Attap, Kampung Attap, 50460 Kuala Lumpur, Wilayah Persekutuan Kuala Lumpur, 马来西亚 ",https://www.binawarehouse.com/,电话: +60 3-2274 6111 ,"271e9fa3230b4eec94b02bf95780f5f2@sentry.wixpress.com, 9a65e97ebe8141fca0c4fd686f70996b@sentry.wixpress.com, ed436f5053144538958ad06a5005e99a@sentry.wixpress.com",Kitchen & Bath Design Center,"Kuala Lumpur, Kuala Lumpur, Malaysia",2026-05-09 09:57
Big Bath (KL),,,"地址: 16, Jalan Metro Pudu, Off, Jln Yew, Fraser Business Park, 55200 Kuala Lumpur, Wilayah Persekutuan Kuala Lumpur, 马来西亚 ",https://www.bigbath.com.my/?utm_source=GBP&utm_medium=GBP&utm_campaign=GBP,电话: +60 19-228 6912 ,sales@bigbath.com.my,Kitchen & Bath Design Center,"Kuala Lumpur, Kuala Lumpur, Malaysia",2026-05-09 09:57
d'looma Jalan Ipoh KL (Dilooma Sdn. Bhd.),,,"地址: No. 238 & 240, Batu 2, Jln Sultan Azlan Shah, Jalan Ipoh, 51200 Kuala Lumpur, Federal Territory of Kuala Lumpur, 马来西亚 ",http://www.dlooma.com.my/,电话: +60 3-4045 5980 ,shop@dlooma.com.my,Kitchen & Bath Design Center,"Kuala Lumpur, Kuala Lumpur, Malaysia",2026-05-09 09:57
KBO Kuche Bath Outlet (Kuchai Lama),,,"地址: G-7 & G-8, Dataran Loka, 9, Jalan Kuchai Lama, Taman Continental, 58200 Kuala Lumpur, Federal Territory of Kuala Lumpur, 马来西亚 ",http://www.kbomy.com/,电话: +60 19-981 6881 ,,Kitchen & Bath Design Center,"Kuala Lumpur, Kuala Lumpur, Malaysia",2026-05-09 09:57
宜家城,,,"地址: 232 & 234, Jln Sultan Azlan Shah, 51200 Kuala Lumpur, Wilayah Persekutuan Kuala Lumpur, 马来西亚 ",http://htrendskb.com.my/,电话: +60 3-4045 8680 ,,Kitchen & Bath Design Center,"Kuala Lumpur, Kuala Lumpur, Malaysia",2026-05-09 09:58
View In Cabinet Design Sdn Bhd,,,"地址: No 12, 14, Jalan 9/155, Bukit Jalil Light Integrated Business Park, 58200 Kuala Lumpur, Wilayah Persekutuan Kuala Lumpur, 马来西亚 ",http://viewincabinet.com/,电话: +60 12-621 3283 ,,Kitchen & Bath Design Center,"Kuala Lumpur, Kuala Lumpur, Malaysia",2026-05-09 09:58
