Name,Rating,Reviews,Address,Website,Phone,Email,关键词,区域,抓取时间
My Renovation Contractor of Kuala Lumpur,,,"地址: 66A-1, Jln Telawi 3, Bangsar, 59100 Kuala Lumpur, Wilayah Persekutuan Kuala Lumpur, 马来西亚 ",https://myrenovationcontractor.com.my/kuala-lumpur/,电话: +60 3-3385 2007 ,info@myrenovationcontractor.com.my,Luxury Renovation Company,"Kuala Lumpur, Kuala Lumpur, Malaysia",2026-05-09 09:46
FS Renovation,,,"地址: 200-G-03, SRI SAUAJAYA CONDOMINIUM, Sentul, 51000 Kuala Lumpur, Wilayah Persekutuan Kuala Lumpur, 马来西亚 ",https://fsrenovation.com/,电话: +60 14-736 4675 ,fazalshahenterprise@gmail.com,Luxury Renovation Company,"Kuala Lumpur, Kuala Lumpur, Malaysia",2026-05-09 09:46
Space Reno,,,"地址: 2750-C, Jalan Changkat Permata, Taman Permata, 53300 Kuala Lumpur, Wilayah Persekutuan Kuala Lumpur, 马来西亚 ",https://spacereno.com/,电话: +60 18-297 1729 ,sales@spacereno.com,Luxury Renovation Company,"Kuala Lumpur, Kuala Lumpur, Malaysia",2026-05-09 09:46
My Renovation Contractor,,,"地址: 34, Jalan Hamzah, Kampung Baru, 50300 Kuala Lumpur, Wilayah Persekutuan Kuala Lumpur, 马来西亚 ",https://myrenovationcontractor.com.my/,电话: +60 3-3385 1982 ,info@myrenovationcontractor.com.my,Luxury Renovation Company,"Kuala Lumpur, Kuala Lumpur, Malaysia",2026-05-09 09:46
My Office Renovation,,,"地址: 23-5, Menara Bangkok Bank Laman Sentral Berjaya No, 105, Jln Ampang, 50450 Kuala Lumpur, 马来西亚 ",https://myofficerenovation.com.my/,电话: +60 10-906 8683 ,info@myofficerenovation.com,Luxury Renovation Company,"Kuala Lumpur, Kuala Lumpur, Malaysia",2026-05-09 09:46
Edge ID - Top Interior designer and renovation company,,,"地址: 36-2, K.L, 36-2, Jalan Pandan Prima 2, Dataran Pandan Prima, 55100 Kuala Lumpur, Selangor, 马来西亚 ",http://edgeid.com.my/,电话: +60 12-311 1344 ,hello@edgeid.com.my,Luxury Renovation Company,"Kuala Lumpur, Kuala Lumpur, Malaysia",2026-05-09 09:47
My Renovation Center – Renovation Contractor Kuala Lumpur,,,"地址: 23-5, Menara Bangkok Bank Berjaya Central Park, 105, Jln Ampang, Kuala Lumpur, 50450 Kuala Lumpur, Federal Territory of Kuala Lumpur, 马来西亚 ",https://myrenovationcenter.com/,电话: +60 11-1109 9888 ,,Luxury Renovation Company,"Kuala Lumpur, Kuala Lumpur, Malaysia",2026-05-09 09:47
LL Redefine Renovation & Design Sdn Bhd,,,"地址: 9 -3, Jalan PJU 5/3, Kota Damansara, 47810 Petaling Jaya, Selangor, 马来西亚 ",https://www.llrr.com.my/,电话: +60 18-219 5001 ,"dd0a55ccb8124b9c9d938e3acf41f8aa@sentry.wixpress.com, admin@llrr.com.my, c183baa23371454f99f417f6616b724d@sentry.wixpress.com",Luxury Renovation Company,"Kuala Lumpur, Kuala Lumpur, Malaysia",2026-05-09 09:47
AW Builders Malaysia | Workshop,,,"地址: 9 -3, Jalan PJU 5/3, Kota Damansara, 47810 Petaling Jaya, Selangor, 马来西亚 ",https://www.llrr.com.my/,电话: +60 18-219 5001 ,"dd0a55ccb8124b9c9d938e3acf41f8aa@sentry.wixpress.com, admin@llrr.com.my, c183baa23371454f99f417f6616b724d@sentry.wixpress.com",Luxury Renovation Company,"Kuala Lumpur, Kuala Lumpur, Malaysia",2026-05-09 09:47
