Name,Rating,Reviews,Address,Website,Phone,Email,关键词,区域,抓取时间
Jia Xin Design Malaysia,,,"地址: Jalan 1/4a, Taman Desa Melawati, 53100 Kuala Lumpur, Wilayah Persekutuan Kuala Lumpur, 马来西亚 ",https://www.facebook.com/jiaxindesign.my,电话: +60 16-688 3518 ,,Luxury Bathroom Design,"Kuala Lumpur, Kuala Lumpur, Malaysia",2026-05-09 10:14
艾迪尔有限公司怡保路分店,,,"地址: 258A & B, 2 1/2 Miles Jalan Sultan Azlan Shah (Jalan Ipoh), Jalan Ipoh, 51200 Kuala Lumpur, Federal Territory of Kuala Lumpur, 马来西亚 ",http://www.topidea.com.my/,电话: +60 16-213 0507 ,info@topidea.com.my,Luxury Bathroom Design,"Kuala Lumpur, Kuala Lumpur, Malaysia",2026-05-09 10:14
Luxesan Home Solution,,,"地址: B-35, 08, Jalan Wangsa Delima, Wangsa Maju, 53300 Kuala Lumpur, Wilayah Persekutuan Kuala Lumpur, 马来西亚 ",https://www.facebook.com/dreamhousekb/,电话: +60 12-662 6600 ,,Luxury Bathroom Design,"Kuala Lumpur, Kuala Lumpur, Malaysia",2026-05-09 10:14
Living Bathrooms Sdn Bhd,,,"地址: 201, Jalan Maarof, Bangsar, 59100 Kuala Lumpur, Wilayah Persekutuan Kuala Lumpur, 马来西亚 ",http://livingbathrooms.com.my/,电话: +60 3-2093 9555 ,"271e9fa3230b4eec94b02bf95780f5f2@sentry.wixpress.com, 9a65e97ebe8141fca0c4fd686f70996b@sentry.wixpress.com, hamizah@livingbathrooms.com.my",Luxury Bathroom Design,"Kuala Lumpur, Kuala Lumpur, Malaysia",2026-05-09 10:14
d'looma Jalan Ipoh KL (Dilooma Sdn. Bhd.),,,"地址: No. 238 & 240, Batu 2, Jln Sultan Azlan Shah, Jalan Ipoh, 51200 Kuala Lumpur, Federal Territory of Kuala Lumpur, 马来西亚 ",http://www.dlooma.com.my/,电话: +60 3-4045 5980 ,shop@dlooma.com.my,Luxury Bathroom Design,"Kuala Lumpur, Kuala Lumpur, Malaysia",2026-05-09 10:15
Big Bath (KL),,,"地址: 16, Jalan Metro Pudu, Off, Jln Yew, Fraser Business Park, 55200 Kuala Lumpur, Wilayah Persekutuan Kuala Lumpur, 马来西亚 ",https://www.bigbath.com.my/?utm_source=GBP&utm_medium=GBP&utm_campaign=GBP,电话: +60 19-228 6912 ,sales@bigbath.com.my,Luxury Bathroom Design,"Kuala Lumpur, Kuala Lumpur, Malaysia",2026-05-09 10:15
Blaine Robert Design,,,"地址: 42-1, Jalan Doraisamy, Chow Kit, 50300 Kuala Lumpur, Wilayah Persekutuan Kuala Lumpur, 马来西亚 ",https://www.blainerobertdesign.com/,电话: +60 13-319 3991 ,,Luxury Bathroom Design,"Kuala Lumpur, Kuala Lumpur, Malaysia",2026-05-09 10:15
A Trio Design Sdn Bhd,,,"地址: Lorong Nikmat 2, off, Jalan Kuchai Lama, Taman Gembira, 58200 Kuala Lumpur, Wilayah Persekutuan Kuala Lumpur, 马来西亚 ",https://www.a-triodesign.com/,电话: +60 12-354 3592 ,info@a-triodesign.com,Luxury Bathroom Design,"Kuala Lumpur, Kuala Lumpur, Malaysia",2026-05-09 10:15
Houz Design-Top Interior Design Petaling Jaya & Kuala Lumpur,,,"地址: Lorong Nikmat 2, off, Jalan Kuchai Lama, Taman Gembira, 58200 Kuala Lumpur, Wilayah Persekutuan Kuala Lumpur, 马来西亚 ",https://www.a-triodesign.com/,电话: +60 12-354 3592 ,info@a-triodesign.com,Luxury Bathroom Design,"Kuala Lumpur, Kuala Lumpur, Malaysia",2026-05-09 10:16
