Name,Rating,Reviews,Address,Website,Phone,Email,关键词,区域,抓取时间
IKAGU UPHOLSTERY SDN BHD (KC CHIN SOFA REFURBISH),,,"地址: Lot AL 250B, Kampung Baru Sungai Buloh, 47000 Sungai Buloh, Selangor, 马来西亚 ",http://www.ikagu.com.my/,电话: +60 12-702 7374 ,,Premium Home Interiors,"Kuala Lumpur, Kuala Lumpur, Malaysia",2026-05-09 10:30
Connect Build Sdn Bhd (HQ),,,"地址: AL-311-KG, LOT 879, Kg baru sungai buloh, 47000 Selangor, 马来西亚 ",https://www.connectbuild.com.my/en,电话: +60 3-6144 0598 ,info@connectbuild.com.my,Premium Home Interiors,"Kuala Lumpur, Kuala Lumpur, Malaysia",2026-05-09 10:30
Timeless Design Sdn Bhd,,,"地址: 54, Jalan Putra, Chow Kit, 50350 Kuala Lumpur, Wilayah Persekutuan Kuala Lumpur, 马来西亚 ",http://www.timelessdesign.com.my/,,"sales@timelessdesign.com.my, info@timelessdesign.com.my",Premium Home Interiors,"Kuala Lumpur, Kuala Lumpur, Malaysia",2026-05-09 10:30
Senni Bangsar | Premium Home Furniture Store,,,"地址: Lot S112, West Wing Level 2, Bangsar Shopping Centre, 285, Jalan Maarof, Bangsar, 59000 Wilayah Perseketuan, Federal Territory of Kuala Lumpur, 马来西亚 ",https://www.sennihome.com/,,,Premium Home Interiors,"Kuala Lumpur, Kuala Lumpur, Malaysia",2026-05-09 10:31
Interior+ Asia,,,"地址: Unit G-01 & 02 & 03, Arte Mont Kiara, Jalan Sultan Haji Ahmad Shah, Kompleks Kerajaan, 50480 Kuala Lumpur, Wilayah Persekutuan Kuala Lumpur, 马来西亚 ",https://interiorplus.asia/,电话: +60 14-887 1446 ,marketing@interiorplus.asia,Premium Home Interiors,"Kuala Lumpur, Kuala Lumpur, Malaysia",2026-05-09 10:31
LE Interiors | Kuala Lumpur,,,"地址: 2-11, Wisma Aman Elite, Jalan Desa Aman 1, Taman Desa Aman, 56100 Cheras, Wilayah Persekutuan Kuala Lumpur, 马来西亚 ",https://www.le-interiors.my/,电话: +60 17-411 3433 ,"Selangorenquiry@le-interiors.my, enquiry@le-interiors.my",Premium Home Interiors,"Kuala Lumpur, Kuala Lumpur, Malaysia",2026-05-09 10:31
