Name,Rating,Reviews,Address,Website,Phone,Email,关键词,区域,抓取时间
Excel Floor Sdn Bhd,,,"地址: No. 1 Latitude, Jalan Subang 7, USJ 1, Taman Perindustrian Subang, 47500 Subang Jaya, Selangor, 马来西亚 ",http://www.excelfloor.com.my/,电话: +60 3-8081 6012 ,,Premium Tile & Stone,"Kuala Lumpur, Kuala Lumpur, Malaysia",2026-05-09 10:11
宝马砖业有限公司,,,"地址: 3, Jalan 6/37a, Taman Bukit Maluri, 52100 Kuala Lumpur, Wilayah Persekutuan Kuala Lumpur, 马来西亚 ",http://www.jubinbms.com.my/,电话: +60 16-227 8648 ,enquiries@jubinbms.com.my,Premium Tile & Stone,"Kuala Lumpur, Kuala Lumpur, Malaysia",2026-05-09 10:12
星美（马）有限公司,,,"地址: 260, Batu 2, Jalan Ipoh, Jln Sultan Azlan Shah, 51200 Kuala Lumpur, 马来西亚 ",https://www.shengbee.com.my/,电话: +60 3-4041 9375 ,,Premium Tile & Stone,"Kuala Lumpur, Kuala Lumpur, Malaysia",2026-05-09 10:12
Dongpeng Malaysia Ceramic Tile & Sintered Stone Gallery,,,"地址: B-02-03 & B-02-03A TOWER B, LEVEL 2 EMHUB, Persiaran Surian, Kota Damansara, 47810 Petaling Jaya, Selangor, 马来西亚 ",https://www.dongpeng.my/,电话: +60 3-6148 9929 ,,Premium Tile & Stone,"Kuala Lumpur, Kuala Lumpur, Malaysia",2026-05-09 10:12
新丰行有限公司,,,"地址: 260E, Jln Sultan Azlan Shah, 51200 Kuala Lumpur, Wilayah Persekutuan Kuala Lumpur, 马来西亚 ",,电话: +60 16-225 9378 ,,Premium Tile & Stone,"Kuala Lumpur, Kuala Lumpur, Malaysia",2026-05-09 10:13
Express Marble (M) Sdn Bhd,,,"地址: Lot 217, Jalan Taman Bukit Desa, Off, Jln Klang Lama, Batu3 1/2, 58100 Kuala Lumpur, 马来西亚 ",http://www.express-marble.com/,电话: +60 3-7983 8886 ,"ken@express-marble.com, alex@express-marble.com, iris@express-marble.com",Premium Tile & Stone,"Kuala Lumpur, Kuala Lumpur, Malaysia",2026-05-09 10:13
