Name,Rating,Reviews,Address,Website,Phone,Email,关键词,区域,抓取时间
EES Concept Sdn Bhd,,,"地址: 27, Jalan Balakong Jaya 3, Taman Industri Balakong Jaya, 43300 Balakong, Selangor, 马来西亚 ",http://www.eesconcept.com.my/shop,电话: +60 3-9544 6366 ,"dd0a55ccb8124b9c9d938e3acf41f8aa@sentry.wixpress.com, 5d1795a2db124a268f1e1bd88f503500@sentry.wixpress.com, 9a65e97ebe8141fca0c4fd686f70996b@sentry.wixpress.com",Retail Home Improvement Center,"Kuala Lumpur, Kuala Lumpur, Malaysia",2026-05-09 10:03
Kampung Baru Hardware Sdn Bhd,,,"地址: 49, Jalan Raja Muda Abdul Aziz, Chow Kit, 50300 Kuala Lumpur, Wilayah Persekutuan Kuala Lumpur, 马来西亚 ",https://www.kampungbaruhardware.com.my/,电话: +60 3-2697 7988 ,"kampungbaruhardwaresd88@gmail.com, 605a7baede844d278b89dc95ae0a9123@sentry-next.wixpress.com, 8eb368c655b84e029ed79ad7a5c1718e@sentry.wixpress.com",Retail Home Improvement Center,"Kuala Lumpur, Kuala Lumpur, Malaysia",2026-05-09 10:03
Tick Hong Hardware & Timber Sdn Bhd,,,"地址: LOT 926, Jalan Sungai Besi, Lebuhraya Sungai Besi, 57100 Kuala Lumpur, 马来西亚 ",http://www.aurous.com.my/,电话: +60 3-9057 2103 ,,Retail Home Improvement Center,"Kuala Lumpur, Kuala Lumpur, Malaysia",2026-05-09 10:04
MR.DIY PLUS,,,"地址: L4.05, Level 4, NU Sentral Mall, Jalan Tun Sambanthan, Brickfields, 50470 Kuala Lumpur, 马来西亚 ",https://www.mrdiy.com/,电话: +60 3-8961 1338 ,,Retail Home Improvement Center,"Kuala Lumpur, Kuala Lumpur, Malaysia",2026-05-09 10:04
Living Portal,,,"地址: G31 & G33, Jalan Pandan Prima 2, Dataran Pandan Prima, 55100 Ampang, 马来西亚 ",http://www.livingportal.com.my/,电话: +60 17-463 6113 ,,Retail Home Improvement Center,"Kuala Lumpur, Kuala Lumpur, Malaysia",2026-05-09 10:04
Dexin Hardware • HQ,,,"地址: 4a, Jalan Kuari, Kampung Cheras Baru, 56100 Kuala Lumpur, Wilayah Persekutuan Kuala Lumpur, 马来西亚 ",https://www.dexinhardware.com/,电话: +60 19-668 6605 ,,Retail Home Improvement Center,"Kuala Lumpur, Kuala Lumpur, Malaysia",2026-05-09 10:04
