Name,Rating,Reviews,Address,Website,Phone,Email,关键词,区域,抓取时间
Noblessa Finest German Kitchens I نوبليسا أرقى المطابخ الألمانية,,,"地址: 2945 7817 Prince Muhammad Ibn Abd Al Aziz, Al Olaya, Riyadh 12313沙特阿拉伯 ",https://noblessa.me/en/riyadh/,电话: +966 11 416 9157 ,,Bespoke kitchen supply store,"Riyadh, Riyadh, Saudi Arabia",2026-05-11 11:28
Colombus Kitchen - كولومبوس تجهيز المطاعم والمخابز,,,"地址: حي، 7441 King Fahd Rd، 3235،, Riyadh 12612沙特阿拉伯 ",https://colombuskitchen.com/?utm_source=Google&utm_medium=Organic&utm_campaign=GMB,电话: +966 56 600 7259 ,,Bespoke kitchen supply store,"Riyadh, Riyadh, Saudi Arabia",2026-05-11 11:28
ZAAHI AL-RIYADH,,,"地址: Al Murabba, 6077 الامير عبدالعزيز بن مساعد بن جلوي، 2470 Riyadh SA, Riyadh 12628沙特阿拉伯 ",https://zahyksa.com/ar/,,,Bespoke kitchen supply store,"Riyadh, Riyadh, Saudi Arabia",2026-05-11 11:28
شركة خط المطابخ السعودية (Kitchen Line ),,,"地址: 4485 Al Imam Saud Ibn Abdul Aziz Branch Rd, At Taawun, Riyadh 12476沙特阿拉伯 ",https://kitchenline.com/ar,电话: +966 800 124 0420 ,info@kitchenline.com,Bespoke kitchen supply store,"Riyadh, Riyadh, Saudi Arabia",2026-05-11 11:28
Inx Kitchen Equipment Showroom,,,"地址: Al Takhassousi, roads, Urubah Road ROBH3549 Urubah branch road between king fahd &, Riyadh 12333沙特阿拉伯 ",https://inox-ksa.com/,电话: +966 9200 34363 ,info@inox-ksa.com,Bespoke kitchen supply store,"Riyadh, Riyadh, Saudi Arabia",2026-05-11 11:28
لاكشيري كيتشين,,,"地址: 3460 6345 Al Imam Saud Ibn Abdul Aziz Branch Rd, Almasiaf, Riyadh 12465沙特阿拉伯 ",,电话: +966 53 332 5884 ,,Bespoke kitchen supply store,"Riyadh, Riyadh, Saudi Arabia",2026-05-11 11:29
