Name,Rating,Reviews,Address,Website,Phone,Email,关键词,区域,抓取时间
"Oppolia Kitchens & interiors, اوبوليا مطابخ وديكورات داخلية",,,"地址: 6674 Al Imam Saud Ibn Abdul Aziz Branch Rd, At Taawun, Riyadh 12476沙特阿拉伯 ",http://www.oppoliaksa.com/,电话: +966 9200 31483 ,,Bespoke kitchen showroom,"Riyadh, Riyadh, Saudi Arabia",2026-05-11 11:27
"Oppolia Kitchens & interiors, اوبوليا مطابخ وديكورات داخلية",,,"地址: Al Takhassousi, Al Olaya, التخصصي, Riyadh 12331沙特阿拉伯 ",https://www.oppoliaksa.com/,电话: +966 9200 31483 ,,Bespoke kitchen showroom,"Riyadh, Riyadh, Saudi Arabia",2026-05-11 11:27
Noblessa Finest German Kitchens I نوبليسا أرقى المطابخ الألمانية,,,"地址: 2945 7817 Prince Muhammad Ibn Abd Al Aziz, Al Olaya, Riyadh 12313沙特阿拉伯 ",https://noblessa.me/en/riyadh/,电话: +966 11 416 9157 ,,Bespoke kitchen showroom,"Riyadh, Riyadh, Saudi Arabia",2026-05-11 11:28
شركة خط المطابخ السعودية (Kitchen Line ),,,"地址: 4485 Al Imam Saud Ibn Abdul Aziz Branch Rd, At Taawun, Riyadh 12476沙特阿拉伯 ",https://kitchenline.com/ar,电话: +966 800 124 0420 ,info@kitchenline.com,Bespoke kitchen showroom,"Riyadh, Riyadh, Saudi Arabia",2026-05-11 11:28
هاوس سوليشنز | House solutions,,,"地址: QP96+64C, At Taawun, Riyadh 12476沙特阿拉伯 ",http://www.finestbusiness.com.sa/,电话: +966 53 737 3720 ,info@finestbusiness.com.sa,Bespoke kitchen showroom,"Riyadh, Riyadh, Saudi Arabia",2026-05-11 11:28
Centro For Kitchens & Wardrobes,,,"地址: 2285 Al Imam Saud Ibn Abdul Aziz Branch Rd, Al Mursilat, Riyadh 12463, Riyadh 12341沙特阿拉伯 ",https://www.modanihomes.com/,电话: +966 11 456 8239 ,,Bespoke kitchen showroom,"Riyadh, Riyadh, Saudi Arabia",2026-05-11 11:28
