Name,Rating,Reviews,Address,Website,Phone,Email,关键词,区域,抓取时间
"Oppolia Kitchens & interiors, اوبوليا مطابخ وديكورات داخلية",,,"地址: 6674 Al Imam Saud Ibn Abdul Aziz Branch Rd, At Taawun, Riyadh 12476沙特阿拉伯 ",http://www.oppoliaksa.com/,电话: +966 9200 31483 ,,Cabinetry complete set wholesaler,"Riyadh, Riyadh, Saudi Arabia",2026-05-11 11:39
كابكو مطابخ خشبية CabCo kitchens,,,"地址: حي, Al-Manakh, Riyadh 14311沙特阿拉伯 ",http://www.cabcokitchens.com/,,,Cabinetry complete set wholesaler,"Riyadh, Riyadh, Saudi Arabia",2026-05-11 11:39
شركة خط المطابخ السعودية (Kitchen Line ),,,"地址: 4485 Al Imam Saud Ibn Abdul Aziz Branch Rd, At Taawun, Riyadh 12476沙特阿拉伯 ",https://kitchenline.com/ar,电话: +966 800 124 0420 ,info@kitchenline.com,Cabinetry complete set wholesaler,"Riyadh, Riyadh, Saudi Arabia",2026-05-11 11:39
"Oppolia Kitchens & interiors, اوبوليا مطابخ وديكورات داخلية",,,"地址: Al Takhassousi, Al Olaya, التخصصي, Riyadh 12331沙特阿拉伯 ",https://www.oppoliaksa.com/,电话: +966 9200 31483 ,,Cabinetry complete set wholesaler,"Riyadh, Riyadh, Saudi Arabia",2026-05-11 11:39
KAFCO Kitchens,,,"地址: 7424 Al Takhassousi, Al Mathar Ash Shamali, Riyadh 12314沙特阿拉伯 ",https://www.kafco-kitchens.com/,电话: +966 11 488 5013 ,,Cabinetry complete set wholesaler,"Riyadh, Riyadh, Saudi Arabia",2026-05-11 11:40
شركة سندباد الجزيرة لتجارة والصناعة,,,"地址: 2709-2943 Al Madina Al Munawwarah Rd, Al Sina'iyah, Riyadh 11458沙特阿拉伯 ",https://sindibad-aljaziera.com/ar/,电话: +966 56 485 6677 ,,Cabinetry complete set wholesaler,"Riyadh, Riyadh, Saudi Arabia",2026-05-11 11:40
