Name,Rating,Reviews,Address,Website,Phone,Email,关键词,区域,抓取时间
Kawader For Commercial Kitchen & Café Equipment,,,"地址: حي، 7206 Prince Abdulaziz Ibn Musaid Ibn Jalawi St, Al Murabba, Riyadh 12628沙特阿拉伯 ",https://kawaderstore.com/,电话: +966 9200 33879 ,,Commercial kitchen cabinet project supplier,"Riyadh, Riyadh, Saudi Arabia",2026-05-11 11:33
شركة خط المطابخ السعودية (Kitchen Line ),,,"地址: 4485 Al Imam Saud Ibn Abdul Aziz Branch Rd, At Taawun, Riyadh 12476沙特阿拉伯 ",https://kitchenline.com/ar,电话: +966 800 124 0420 ,info@kitchenline.com,Commercial kitchen cabinet project supplier,"Riyadh, Riyadh, Saudi Arabia",2026-05-11 11:33
شركة سندباد الجزيرة لتجارة والصناعة,,,"地址: 2709-2943 Al Madina Al Munawwarah Rd, Al Sina'iyah, Riyadh 11458沙特阿拉伯 ",https://sindibad-aljaziera.com/ar/,电话: +966 56 485 6677 ,,Commercial kitchen cabinet project supplier,"Riyadh, Riyadh, Saudi Arabia",2026-05-11 11:33
Colombus Kitchen - كولومبوس تجهيز المطاعم والمخابز,,,"地址: حي، 7441 King Fahd Rd، 3235،, Riyadh 12612沙特阿拉伯 ",https://colombuskitchen.com/?utm_source=Google&utm_medium=Organic&utm_campaign=GMB,电话: +966 56 600 7259 ,,Commercial kitchen cabinet project supplier,"Riyadh, Riyadh, Saudi Arabia",2026-05-11 11:34
"Oppolia Kitchens & interiors, اوبوليا مطابخ وديكورات داخلية",,,"地址: 6674 Al Imam Saud Ibn Abdul Aziz Branch Rd, At Taawun, Riyadh 12476沙特阿拉伯 ",http://www.oppoliaksa.com/,电话: +966 9200 31483 ,,Commercial kitchen cabinet project supplier,"Riyadh, Riyadh, Saudi Arabia",2026-05-11 11:34
"Oppolia Kitchens & interiors, اوبوليا مطابخ وديكورات داخلية",,,"地址: Al Takhassousi, Al Olaya, التخصصي, Riyadh 12331沙特阿拉伯 ",https://www.oppoliaksa.com/,电话: +966 9200 31483 ,,Commercial kitchen cabinet project supplier,"Riyadh, Riyadh, Saudi Arabia",2026-05-11 11:34
