Name,Rating,Reviews,Address,Website,Phone,Email,关键词,区域,抓取时间
Kawader For Commercial Kitchen & Café Equipment,,,"地址: حي، 7206 Prince Abdulaziz Ibn Musaid Ibn Jalawi St, Al Murabba, Riyadh 12628沙特阿拉伯 ",https://kawaderstore.com/,电话: +966 9200 33879 ,,High end kitchen wholesaler,"Riyadh, Riyadh, Saudi Arabia",2026-05-11 11:35
Colombus Kitchen - كولومبوس تجهيز المطاعم والمخابز,,,"地址: حي، 7441 King Fahd Rd، 3235،, Riyadh 12612沙特阿拉伯 ",https://colombuskitchen.com/?utm_source=Google&utm_medium=Organic&utm_campaign=GMB,电话: +966 56 600 7259 ,,High end kitchen wholesaler,"Riyadh, Riyadh, Saudi Arabia",2026-05-11 11:35
شركة قصر الرياض التجارية,,,"地址: شارع الأمير عبدالعزيزبن جلوي، حي المربع، الرياض 12613، شارع الضباب / مقابل مبنى ساب, Riyadh 12613沙特阿拉伯 ",http://www.riyadhpalace-store.com/,电话: +966 11 220 0090 ,info@riyadhpalace.net,High end kitchen wholesaler,"Riyadh, Riyadh, Saudi Arabia",2026-05-11 11:35
ZAAHI AL-RIYADH,,,"地址: Al Murabba, 6077 الامير عبدالعزيز بن مساعد بن جلوي، 2470 Riyadh SA, Riyadh 12628沙特阿拉伯 ",https://zahyksa.com/ar/,,,High end kitchen wholesaler,"Riyadh, Riyadh, Saudi Arabia",2026-05-11 11:36
شركة خط المطابخ السعودية (Kitchen Line ),,,"地址: 4485 Al Imam Saud Ibn Abdul Aziz Branch Rd, At Taawun, Riyadh 12476沙特阿拉伯 ",https://kitchenline.com/ar,电话: +966 800 124 0420 ,info@kitchenline.com,High end kitchen wholesaler,"Riyadh, Riyadh, Saudi Arabia",2026-05-11 11:36
Port Stores متجر الميناء,,,"地址: Prince Sultan Bin Abdulaziz Rd, As Sulimaniyah, Riyadh 12223沙特阿拉伯 ",http://www.portstores.com/,电话: +966 11 462 7652 ,web@portstores.com,High end kitchen wholesaler,"Riyadh, Riyadh, Saudi Arabia",2026-05-11 11:36
