Name,Rating,Reviews,Address,Website,Phone,Email,关键词,区域,抓取时间
Noblessa Finest German Kitchens I نوبليسا أرقى المطابخ الألمانية,,,"地址: 2945 7817 Prince Muhammad Ibn Abd Al Aziz, Al Olaya, Riyadh 12313沙特阿拉伯 ",https://noblessa.me/en/riyadh/,电话: +966 11 416 9157 ,,High end kitchen remodeling supply,"Riyadh, Riyadh, Saudi Arabia",2026-05-11 11:37
شركة خط المطابخ السعودية (Kitchen Line ),,,"地址: 4485 Al Imam Saud Ibn Abdul Aziz Branch Rd, At Taawun, Riyadh 12476沙特阿拉伯 ",https://kitchenline.com/ar,电话: +966 800 124 0420 ,info@kitchenline.com,High end kitchen remodeling supply,"Riyadh, Riyadh, Saudi Arabia",2026-05-11 11:37
AlKhaleejion Kitchens,,,"地址: طريق التخصصي At Takhassusi St قرب مستشفى د. سليمان الحبيب, Riyadh 12382沙特阿拉伯 ",http://www.alkhaleejion.com/,电话: +966 9200 13032 ,,High end kitchen remodeling supply,"Riyadh, Riyadh, Saudi Arabia",2026-05-11 11:37
لاكشيري كيتشين,,,"地址: 3460 6345 Al Imam Saud Ibn Abdul Aziz Branch Rd, Almasiaf, Riyadh 12465沙特阿拉伯 ",,电话: +966 53 332 5884 ,,High end kitchen remodeling supply,"Riyadh, Riyadh, Saudi Arabia",2026-05-11 11:38
هاوس سوليشنز | House solutions,,,"地址: QP96+64C, At Taawun, Riyadh 12476沙特阿拉伯 ",http://www.finestbusiness.com.sa/,电话: +966 53 737 3720 ,info@finestbusiness.com.sa,High end kitchen remodeling supply,"Riyadh, Riyadh, Saudi Arabia",2026-05-11 11:38
أبيات,,,"地址: QP96+64C, At Taawun, Riyadh 12476沙特阿拉伯 ",http://www.finestbusiness.com.sa/,电话: +966 53 737 3720 ,info@finestbusiness.com.sa,High end kitchen remodeling supply,"Riyadh, Riyadh, Saudi Arabia",2026-05-11 11:38
