Name,Rating,Reviews,Address,Website,Phone,Email,关键词,区域,抓取时间
أبيات,,,"地址: 4244 Northern Ring Br Rd, Al Ghadir, Riyadh 13311沙特阿拉伯 ",https://www.abyat.com/,电话: +966 800 121 5555 ,,Kitchen island design center,"Riyadh, Riyadh, Saudi Arabia",2026-05-11 11:19
IKEA,,,"地址: Northern Ring Br Rd, Al Ghadir, Riyadh 12284沙特阿拉伯 ",https://www.ikea.com/sa/ar/stores/planning-studios/riyadh/?utm_source=gbp&utm_medium=organic&utm_campaign=riyadh-planning-studio,电话: +966 9200 04532 ,,Kitchen island design center,"Riyadh, Riyadh, Saudi Arabia",2026-05-11 11:19
Centro For Kitchens & Wardrobes,,,"地址: 2285 Al Imam Saud Ibn Abdul Aziz Branch Rd, Al Mursilat, Riyadh 12463, Riyadh 12341沙特阿拉伯 ",https://www.modanihomes.com/,电话: +966 11 456 8239 ,,Kitchen island design center,"Riyadh, Riyadh, Saudi Arabia",2026-05-11 11:19
AlKhaleejion Kitchens,,,"地址: طريق التخصصي At Takhassusi St قرب مستشفى د. سليمان الحبيب, Riyadh 12382沙特阿拉伯 ",http://www.alkhaleejion.com/,电话: +966 9200 13032 ,,Kitchen island design center,"Riyadh, Riyadh, Saudi Arabia",2026-05-11 11:19
Crestwood kitchens,,,"地址: 11427 خيرالدين الرملي, Al Olaya, Riyadh 12331沙特阿拉伯 ",https://linktr.ee/crestwood_ksa,电话: +966 53 518 8853 ,,Kitchen island design center,"Riyadh, Riyadh, Saudi Arabia",2026-05-11 11:19
"Oppolia Kitchens & interiors, اوبوليا مطابخ وديكورات داخلية",,,"地址: 11427 خيرالدين الرملي, Al Olaya, Riyadh 12331沙特阿拉伯 ",https://linktr.ee/crestwood_ksa,电话: +966 53 518 8853 ,,Kitchen island design center,"Riyadh, Riyadh, Saudi Arabia",2026-05-11 11:20
