Name,Rating,Reviews,Address,Website,Phone,Email,关键词,区域,抓取时间
"Oppolia Kitchens & interiors, اوبوليا مطابخ وديكورات داخلية",,,"地址: 6674 Al Imam Saud Ibn Abdul Aziz Branch Rd, At Taawun, Riyadh 12476沙特阿拉伯 ",http://www.oppoliaksa.com/,电话: +966 9200 31483 ,,Kitchen cabinet design center,"Riyadh, Riyadh, Saudi Arabia",2026-05-11 11:07
شركة خط المطابخ السعودية (Kitchen Line ),,,"地址: 4485 Al Imam Saud Ibn Abdul Aziz Branch Rd, At Taawun, Riyadh 12476沙特阿拉伯 ",https://kitchenline.com/ar,电话: +966 800 124 0420 ,info@kitchenline.com,Kitchen cabinet design center,"Riyadh, Riyadh, Saudi Arabia",2026-05-11 11:07
"Oppolia Kitchens & interiors, اوبوليا مطابخ وديكورات داخلية",,,"地址: Al Takhassousi, Al Olaya, التخصصي, Riyadh 12331沙特阿拉伯 ",https://www.oppoliaksa.com/,电话: +966 9200 31483 ,,Kitchen cabinet design center,"Riyadh, Riyadh, Saudi Arabia",2026-05-11 11:07
هاوس سوليشنز | House solutions,,,"地址: QP96+64C, At Taawun, Riyadh 12476沙特阿拉伯 ",http://www.finestbusiness.com.sa/,电话: +966 53 737 3720 ,info@finestbusiness.com.sa,Kitchen cabinet design center,"Riyadh, Riyadh, Saudi Arabia",2026-05-11 11:08
KITCHEN RA | كيتشن را,,,"地址: طريق الإمام سعود بن عبدالعزيز بن محمد،, Al Mursalat, Riyadh 12464沙特阿拉伯 ",,电话: +966 53 343 3147 ,,Kitchen cabinet design center,"Riyadh, Riyadh, Saudi Arabia",2026-05-11 11:08
Diniz Kitchen,,,"地址: طريق الأمام سعود بن عبدالعزيز, At Taawun, Riyadh 12476沙特阿拉伯 ",https://www.instagram.com/dinizkitchensa/,电话: +966 53 666 6638 ,,Kitchen cabinet design center,"Riyadh, Riyadh, Saudi Arabia",2026-05-11 11:08
