Name,Rating,Reviews,Address,Website,Phone,Email,关键词,区域,抓取时间
KITCHEN RA | كيتشن را,,,"地址: طريق الإمام سعود بن عبدالعزيز بن محمد،, Al Mursalat, Riyadh 12464沙特阿拉伯 ",,电话: +966 53 343 3147 ,,Kitchen cabinet builders merchant,"Riyadh, Riyadh, Saudi Arabia",2026-05-11 11:09
kitchen cabinet,,,"地址: Nasim haraj, Al Olaya, Riyadh 12211沙特阿拉伯 ",https://www.youtube.com/@funworld5081,电话: +966 53 934 3894 ,,Kitchen cabinet builders merchant,"Riyadh, Riyadh, Saudi Arabia",2026-05-11 11:09
KAFCO Kitchens,,,"地址: 7424 Al Takhassousi, Al Mathar Ash Shamali, Riyadh 12314沙特阿拉伯 ",https://www.kafco-kitchens.com/,电话: +966 11 488 5013 ,,Kitchen cabinet builders merchant,"Riyadh, Riyadh, Saudi Arabia",2026-05-11 11:09
"Oppolia Kitchens & interiors, اوبوليا مطابخ وديكورات داخلية",,,"地址: 6674 Al Imam Saud Ibn Abdul Aziz Branch Rd, At Taawun, Riyadh 12476沙特阿拉伯 ",http://www.oppoliaksa.com/,电话: +966 9200 31483 ,,Kitchen cabinet builders merchant,"Riyadh, Riyadh, Saudi Arabia",2026-05-11 11:09
"Oppolia Kitchens & interiors, اوبوليا مطابخ وديكورات داخلية",,,"地址: Al Takhassousi, Al Olaya, التخصصي, Riyadh 12331沙特阿拉伯 ",https://www.oppoliaksa.com/,电话: +966 9200 31483 ,,Kitchen cabinet builders merchant,"Riyadh, Riyadh, Saudi Arabia",2026-05-11 11:09
هاوس سوليشنز | House solutions,,,"地址: Al Takhassousi, Al Olaya, التخصصي, Riyadh 12331沙特阿拉伯 ",https://www.oppoliaksa.com/,电话: +966 9200 31483 ,,Kitchen cabinet builders merchant,"Riyadh, Riyadh, Saudi Arabia",2026-05-11 11:09
