Name,Rating,Reviews,Address,Website,Phone,Email,关键词,区域,抓取时间
هاوس سوليشنز | House solutions,,,"地址: QP96+64C, At Taawun, Riyadh 12476沙特阿拉伯 ",http://www.finestbusiness.com.sa/,电话: +966 53 737 3720 ,info@finestbusiness.com.sa,Kitchen cabinet property developer,"Riyadh, Riyadh, Saudi Arabia",2026-05-11 11:09
شركة خط المطابخ السعودية (Kitchen Line ),,,"地址: 4485 Al Imam Saud Ibn Abdul Aziz Branch Rd, At Taawun, Riyadh 12476沙特阿拉伯 ",https://kitchenline.com/ar,电话: +966 800 124 0420 ,info@kitchenline.com,Kitchen cabinet property developer,"Riyadh, Riyadh, Saudi Arabia",2026-05-11 11:09
"Oppolia Kitchens & interiors, اوبوليا مطابخ وديكورات داخلية",,,"地址: 6674 Al Imam Saud Ibn Abdul Aziz Branch Rd, At Taawun, Riyadh 12476沙特阿拉伯 ",http://www.oppoliaksa.com/,电话: +966 9200 31483 ,,Kitchen cabinet property developer,"Riyadh, Riyadh, Saudi Arabia",2026-05-11 11:09
AlKhaleejion Kitchens,,,"地址: طريق التخصصي At Takhassusi St قرب مستشفى د. سليمان الحبيب, Riyadh 12382沙特阿拉伯 ",http://www.alkhaleejion.com/,电话: +966 9200 13032 ,,Kitchen cabinet property developer,"Riyadh, Riyadh, Saudi Arabia",2026-05-11 11:10
"Oppolia Kitchens & interiors, اوبوليا مطابخ وديكورات داخلية",,,"地址: Al Takhassousi, Al Olaya, التخصصي, Riyadh 12331沙特阿拉伯 ",https://www.oppoliaksa.com/,电话: +966 9200 31483 ,,Kitchen cabinet property developer,"Riyadh, Riyadh, Saudi Arabia",2026-05-11 11:10
KAFCO Kitchens,,,"地址: 7424 Al Takhassousi, Al Mathar Ash Shamali, Riyadh 12314沙特阿拉伯 ",https://www.kafco-kitchens.com/,电话: +966 11 488 5013 ,,Kitchen cabinet property developer,"Riyadh, Riyadh, Saudi Arabia",2026-05-11 11:10
