Name,Rating,Reviews,Address,Website,Phone,Email,关键词,区域,抓取时间
أبيات,,,"地址: 4244 Northern Ring Br Rd, Al Ghadir, Riyadh 13311沙特阿拉伯 ",https://www.abyat.com/,电话: +966 800 121 5555 ,,Kitchen island supplier,"Riyadh, Riyadh, Saudi Arabia",2026-05-11 11:18
شركة خط المطابخ السعودية (Kitchen Line ),,,"地址: 4485 Al Imam Saud Ibn Abdul Aziz Branch Rd, At Taawun, Riyadh 12476沙特阿拉伯 ",https://kitchenline.com/ar,电话: +966 800 124 0420 ,info@kitchenline.com,Kitchen island supplier,"Riyadh, Riyadh, Saudi Arabia",2026-05-11 11:19
KAFCO Kitchens,,,"地址: 7424 Al Takhassousi, Al Mathar Ash Shamali, Riyadh 12314沙特阿拉伯 ",https://www.kafco-kitchens.com/,电话: +966 11 488 5013 ,,Kitchen island supplier,"Riyadh, Riyadh, Saudi Arabia",2026-05-11 11:19
"Oppolia Kitchens & interiors, اوبوليا مطابخ وديكورات داخلية",,,"地址: Al Takhassousi, Al Olaya, التخصصي, Riyadh 12331沙特阿拉伯 ",https://www.oppoliaksa.com/,电话: +966 9200 31483 ,,Kitchen island supplier,"Riyadh, Riyadh, Saudi Arabia",2026-05-11 11:19
شركة سندباد الجزيرة لتجارة والصناعة,,,"地址: 2709-2943 Al Madina Al Munawwarah Rd, Al Sina'iyah, Riyadh 11458沙特阿拉伯 ",https://sindibad-aljaziera.com/ar/,电话: +966 56 485 6677 ,,Kitchen island supplier,"Riyadh, Riyadh, Saudi Arabia",2026-05-11 11:19
لاكشيري كيتشين,,,"地址: 2709-2943 Al Madina Al Munawwarah Rd, Al Sina'iyah, Riyadh 11458沙特阿拉伯 ",https://sindibad-aljaziera.com/ar/,电话: +966 56 485 6677 ,,Kitchen island supplier,"Riyadh, Riyadh, Saudi Arabia",2026-05-11 11:20
