Name,Rating,Reviews,Address,Website,Phone,Email,关键词,区域,抓取时间
"Oppolia Kitchens & interiors, اوبوليا مطابخ وديكورات داخلية",,,"地址: 6674 Al Imam Saud Ibn Abdul Aziz Branch Rd, At Taawun, Riyadh 12476沙特阿拉伯 ",http://www.oppoliaksa.com/,电话: +966 9200 31483 ,,Kitchen cabinet manufacturer,"Riyadh, Riyadh, Saudi Arabia",2026-05-11 11:09
"Oppolia Kitchens & interiors, اوبوليا مطابخ وديكورات داخلية",,,"地址: Al Takhassousi, Al Olaya, التخصصي, Riyadh 12331沙特阿拉伯 ",https://www.oppoliaksa.com/,电话: +966 9200 31483 ,,Kitchen cabinet manufacturer,"Riyadh, Riyadh, Saudi Arabia",2026-05-11 11:09
أبيات,,,"地址: 4244 Northern Ring Br Rd, Al Ghadir, Riyadh 13311沙特阿拉伯 ",https://www.abyat.com/,电话: +966 800 121 5555 ,,Kitchen cabinet manufacturer,"Riyadh, Riyadh, Saudi Arabia",2026-05-11 11:09
Martina Kitchen And Cabinets | مارتينا للمطابخ والخزائن,,,"地址: Almasiaf, Riyadh 12465沙特阿拉伯 ",http://www.martina.com.sa/,电话: +966 56 868 5921 ,,Kitchen cabinet manufacturer,"Riyadh, Riyadh, Saudi Arabia",2026-05-11 11:10
شركة خط المطابخ السعودية (Kitchen Line ),,,"地址: 4485 Al Imam Saud Ibn Abdul Aziz Branch Rd, At Taawun, Riyadh 12476沙特阿拉伯 ",https://kitchenline.com/ar,电话: +966 800 124 0420 ,info@kitchenline.com,Kitchen cabinet manufacturer,"Riyadh, Riyadh, Saudi Arabia",2026-05-11 11:10
KAFCO Factory,,,"地址: 8127 New Industrial Area, Riyadh 14334 8127 المدينة الصناعية الجديدة، الرياض 14334, Riyadh 11383沙特阿拉伯 ",https://www.kafco-kitchens.com/,电话: +966 11 265 1999 ,,Kitchen cabinet manufacturer,"Riyadh, Riyadh, Saudi Arabia",2026-05-11 11:10
