Name,Rating,Reviews,Address,Website,Phone,Email,关键词,区域,抓取时间
Diniz Kitchen,,,"地址: طريق الأمام سعود بن عبدالعزيز, At Taawun, Riyadh 12476沙特阿拉伯 ",https://www.instagram.com/dinizkitchensa/,电话: +966 53 666 6638 ,,Pantry cabinet general contractor,"Riyadh, Riyadh, Saudi Arabia",2026-05-11 11:18
شركة زاوية سما للصناعة,,,"地址: Al Madina Al Munawwarah Rd, Al Sina'iyah، مخرج 17, Riyadh 12844沙特阿拉伯 ",http://www.samacorner.com/,电话: +966 50 413 6710 ,samacorner@yahoo.com,Pantry cabinet general contractor,"Riyadh, Riyadh, Saudi Arabia",2026-05-11 11:18
"Oppolia Kitchens & interiors, اوبوليا مطابخ وديكورات داخلية",,,"地址: 6674 Al Imam Saud Ibn Abdul Aziz Branch Rd, At Taawun, Riyadh 12476沙特阿拉伯 ",http://www.oppoliaksa.com/,电话: +966 9200 31483 ,,Pantry cabinet general contractor,"Riyadh, Riyadh, Saudi Arabia",2026-05-11 11:19
AlKhaleejion Kitchens,,,"地址: طريق التخصصي At Takhassusi St قرب مستشفى د. سليمان الحبيب, Riyadh 12382沙特阿拉伯 ",http://www.alkhaleejion.com/,电话: +966 9200 13032 ,,Pantry cabinet general contractor,"Riyadh, Riyadh, Saudi Arabia",2026-05-11 11:19
أبيات,,,"地址: 4244 Northern Ring Br Rd, Al Ghadir, Riyadh 13311沙特阿拉伯 ",https://www.abyat.com/,电话: +966 800 121 5555 ,,Pantry cabinet general contractor,"Riyadh, Riyadh, Saudi Arabia",2026-05-11 11:19
مطابخ الأبيض المتحدة | United White Kitchens,,,"地址: Imam Saud Bin Abdulaziz Bin Mohammed Rd, At Taawun, Riyadh 12476沙特阿拉伯 ",http://www.uwkitchens.com/,电话: +966 9200 31000 ,info@uwkitchens.com,Pantry cabinet general contractor,"Riyadh, Riyadh, Saudi Arabia",2026-05-11 11:19
عبدالله صالح للديكور والدهانات,,,"地址: HJV7+4J5, Prince Musaid Ibn Abdulrahman Ibn Faisal St, Aluraija Al Gharbiyah, Riyadh 12976沙特阿拉伯 ",https://najar-we-dahant-riyadh.online/myweb/index.html,电话: +966 59 296 5038 ,,Pantry cabinet general contractor,"Riyadh, Riyadh, Saudi Arabia",2026-05-11 11:20
Shaden House Porta Cabin,,,"地址: Hyt, Riyadh 14368沙特阿拉伯 ",,电话: +966 55 446 7464 ,,Pantry cabinet general contractor,"Riyadh, Riyadh, Saudi Arabia",2026-05-11 11:20
Khan Expert Carpenter,,,"地址: Al Andalus, Riyadh 13212沙特阿拉伯 ",https://khanexpertcarpenter.com/,电话: +966 59 432 1981 ,khanpkpti1122@gmail.com,Pantry cabinet general contractor,"Riyadh, Riyadh, Saudi Arabia",2026-05-11 11:20
