Name,Rating,Reviews,Address,Website,Phone,Email,关键词,区域,抓取时间
صلابة المعدن منتجات الاستانلس ستيل ومعدات تجهيزات المطابخ المركزية,,,"地址: Al haqo, An Noor, Riyadh 14321沙特阿拉伯 ",https://solidmetal-gulf.com/,电话: +966 55 744 5181 ,,Stainless steel kitchen procurement,"Riyadh, Riyadh, Saudi Arabia",2026-05-11 11:25
ZAAHI AL-RIYADH,,,"地址: Al Murabba, 6077 الامير عبدالعزيز بن مساعد بن جلوي، 2470 Riyadh SA, Riyadh 12628沙特阿拉伯 ",https://zahyksa.com/ar/,,,Stainless steel kitchen procurement,"Riyadh, Riyadh, Saudi Arabia",2026-05-11 11:25
ربض للصناعات المعدنية - Rabadh for Metal Industries - RMI,,,"地址: Asilah St, As Sulay, Riyadh 14264沙特阿拉伯 ",http://www.rabadh.com/,电话: +966 53 871 1366 ,marketing@rabadh.com,Stainless steel kitchen procurement,"Riyadh, Riyadh, Saudi Arabia",2026-05-11 11:25
اعمال الاستانلس ستيل بالرياض,,,"地址: الحنفا, As Sulay, Riyadh 14274沙特阿拉伯 ",,电话: +966 50 679 9800 ,,Stainless steel kitchen procurement,"Riyadh, Riyadh, Saudi Arabia",2026-05-11 11:26
Kawader For Commercial Kitchen & Café Equipment,,,"地址: حي، 7206 Prince Abdulaziz Ibn Musaid Ibn Jalawi St, Al Murabba, Riyadh 12628沙特阿拉伯 ",https://kawaderstore.com/,电话: +966 9200 33879 ,,Stainless steel kitchen procurement,"Riyadh, Riyadh, Saudi Arabia",2026-05-11 11:26
"AL HALEES GROUP, KITCHEN SUPPLY STORE شركة مجموعة الهليس تجهيزات مطاعم ومقاهي",,,"地址: 4061 طريق الأمير محمد بن عبدالرحمن الفرعي, Al Khalidiyyah, Riyadh 12875沙特阿拉伯 ",http://www.alhaleesgroup.com/,电话: +966 11 447 7397 ,cs@alhaleesgroup.com.sa,Stainless steel kitchen procurement,"Riyadh, Riyadh, Saudi Arabia",2026-05-11 11:26
