Name,Rating,Reviews,Address,Website,Phone,Email,关键词,区域,抓取时间
شركة خط المطابخ السعودية (Kitchen Line ),,,"地址: 4485 Al Imam Saud Ibn Abdul Aziz Branch Rd, At Taawun, Riyadh 12476沙特阿拉伯 ",https://kitchenline.com/ar,电话: +966 800 124 0420 ,info@kitchenline.com,Stainless steel kitchen showroom,"Riyadh, Riyadh, Saudi Arabia",2026-05-11 11:23
Ribal for stainless steel works,,,"地址: شارع الحواجز, As Sulay, صناعية, Riyadh 19012沙特阿拉伯 ",,电话: +966 55 079 7230 ,,Stainless steel kitchen showroom,"Riyadh, Riyadh, Saudi Arabia",2026-05-11 11:24
صلابة المعدن منتجات الاستانلس ستيل ومعدات تجهيزات المطابخ المركزية,,,"地址: Al haqo, An Noor, Riyadh 14321沙特阿拉伯 ",https://solidmetal-gulf.com/,电话: +966 55 744 5181 ,,Stainless steel kitchen showroom,"Riyadh, Riyadh, Saudi Arabia",2026-05-11 11:24
اعمال الاستانلس ستيل بالرياض,,,"地址: الحنفا, As Sulay, Riyadh 14274沙特阿拉伯 ",,电话: +966 50 679 9800 ,,Stainless steel kitchen showroom,"Riyadh, Riyadh, Saudi Arabia",2026-05-11 11:24
هاوس سوليشنز | House solutions,,,"地址: QP96+64C, At Taawun, Riyadh 12476沙特阿拉伯 ",http://www.finestbusiness.com.sa/,电话: +966 53 737 3720 ,info@finestbusiness.com.sa,Stainless steel kitchen showroom,"Riyadh, Riyadh, Saudi Arabia",2026-05-11 11:24
Colombus Kitchen - كولومبوس تجهيز المطاعم والمخابز,,,"地址: حي، 7441 King Fahd Rd، 3235،, Riyadh 12612沙特阿拉伯 ",https://colombuskitchen.com/?utm_source=Google&utm_medium=Organic&utm_campaign=GMB,电话: +966 56 600 7259 ,,Stainless steel kitchen showroom,"Riyadh, Riyadh, Saudi Arabia",2026-05-11 11:24
