Name,Rating,Reviews,Address,Website,Phone,Email,关键词,区域,抓取时间
ZAAHI AL-RIYADH,,,"地址: Al Murabba, 6077 الامير عبدالعزيز بن مساعد بن جلوي، 2470 Riyadh SA, Riyadh 12628沙特阿拉伯 ",https://zahyksa.com/ar/,,,Stainless steel kitchen importer,"Riyadh, Riyadh, Saudi Arabia",2026-05-11 11:23
صلابة المعدن منتجات الاستانلس ستيل ومعدات تجهيزات المطابخ المركزية,,,"地址: Al haqo, An Noor, Riyadh 14321沙特阿拉伯 ",https://solidmetal-gulf.com/,电话: +966 55 744 5181 ,,Stainless steel kitchen importer,"Riyadh, Riyadh, Saudi Arabia",2026-05-11 11:24
Kawader For Commercial Kitchen & Café Equipment,,,"地址: حي، 7206 Prince Abdulaziz Ibn Musaid Ibn Jalawi St, Al Murabba, Riyadh 12628沙特阿拉伯 ",https://kawaderstore.com/,电话: +966 9200 33879 ,,Stainless steel kitchen importer,"Riyadh, Riyadh, Saudi Arabia",2026-05-11 11:24
Colombus Kitchen - كولومبوس تجهيز المطاعم والمخابز,,,"地址: حي، 7441 King Fahd Rd، 3235،, Riyadh 12612沙特阿拉伯 ",https://colombuskitchen.com/?utm_source=Google&utm_medium=Organic&utm_campaign=GMB,电话: +966 56 600 7259 ,,Stainless steel kitchen importer,"Riyadh, Riyadh, Saudi Arabia",2026-05-11 11:24
شركة قصر الرياض التجارية,,,"地址: شارع الأمير عبدالعزيزبن جلوي، حي المربع، الرياض 12613، شارع الضباب / مقابل مبنى ساب, Riyadh 12613沙特阿拉伯 ",http://www.riyadhpalace-store.com/,电话: +966 11 220 0090 ,info@riyadhpalace.net,Stainless steel kitchen importer,"Riyadh, Riyadh, Saudi Arabia",2026-05-11 11:24
"AL HALEES GROUP, KITCHEN SUPPLY STORE شركة مجموعة الهليس تجهيزات مطاعم ومقاهي",,,"地址: 4061 طريق الأمير محمد بن عبدالرحمن الفرعي, Al Khalidiyyah, Riyadh 12875沙特阿拉伯 ",http://www.alhaleesgroup.com/,电话: +966 11 447 7397 ,cs@alhaleesgroup.com.sa,Stainless steel kitchen importer,"Riyadh, Riyadh, Saudi Arabia",2026-05-11 11:25
