Name,Rating,Reviews,Address,Website,Phone,Email,关键词,区域,抓取时间
صلابة المعدن منتجات الاستانلس ستيل ومعدات تجهيزات المطابخ المركزية,,,"地址: Al haqo, An Noor, Riyadh 14321沙特阿拉伯 ",https://solidmetal-gulf.com/,电话: +966 55 744 5181 ,,Stainless steel kitchen trading company,"Riyadh, Riyadh, Saudi Arabia",2026-05-11 11:25
Kawader For Commercial Kitchen & Café Equipment,,,"地址: حي، 7206 Prince Abdulaziz Ibn Musaid Ibn Jalawi St, Al Murabba, Riyadh 12628沙特阿拉伯 ",https://kawaderstore.com/,电话: +966 9200 33879 ,,Stainless steel kitchen trading company,"Riyadh, Riyadh, Saudi Arabia",2026-05-11 11:25
ZAAHI AL-RIYADH,,,"地址: Al Murabba, 6077 الامير عبدالعزيز بن مساعد بن جلوي، 2470 Riyadh SA, Riyadh 12628沙特阿拉伯 ",https://zahyksa.com/ar/,,,Stainless steel kitchen trading company,"Riyadh, Riyadh, Saudi Arabia",2026-05-11 11:25
مؤسسة الخنبشي لأدوات المطابخ والمطاعم والفنادق,,,"地址: 7214-7192 Al Oumraniah, Al-Shemaysi, Riyadh 12745沙特阿拉伯 ",https://alkhanbasiksa.com/,电话: +966 50 999 1568 ,,Stainless steel kitchen trading company,"Riyadh, Riyadh, Saudi Arabia",2026-05-11 11:25
شركة اناقة المطبخ للتجارة Elegance kitchen,,,"地址: Prince Abdulaziz Ibn Musaid Ibn Jalawi St, As Sulimaniyah, Riyadh 12621沙特阿拉伯 ",,电话: +966 55 330 2118 ,,Stainless steel kitchen trading company,"Riyadh, Riyadh, Saudi Arabia",2026-05-11 11:26
"AL HALEES GROUP, KITCHEN SUPPLY STORE شركة مجموعة الهليس تجهيزات مطاعم ومقاهي",,,"地址: 4061 طريق الأمير محمد بن عبدالرحمن الفرعي, Al Khalidiyyah, Riyadh 12875沙特阿拉伯 ",http://www.alhaleesgroup.com/,电话: +966 11 447 7397 ,,Stainless steel kitchen trading company,"Riyadh, Riyadh, Saudi Arabia",2026-05-11 11:26
