Name,Rating,Reviews,Address,Website,Phone,Email,关键词,区域,抓取时间
CMV Interior Designs,,,"地址: Level 10-1 Fort Legend Tower 31st Street and, 3rd Ave, Post Proper Northside, Taguig, 1634 Metro Manila, 菲律宾 ",https://christinemanalovillamora.com/,电话: +63 927 570 5357 ,,Interior Design Material Supplier,"BGC, Manila, Philippines",2026-03-20 17:23
BoConcept MOs Design,,,"地址: MOs Design, 1st Flr, Bonifacio High Street 9th Ave, Taguig, 1630 Metro Manila, 菲律宾 ",http://www.boconcept.com.ph/?y_source=1_MjAzMzkwNjAtNzE1LWxvY2F0aW9uLndlYnNpdGU=,电话: +63 917 572 7974 ,"boconceptshangrila@gmail.com, hello@mosdesign.com.ph, support@boconcept.com",Interior Design Material Supplier,"BGC, Manila, Philippines",2026-03-20 17:23
"Shee Design Interiors, PH.",,,"地址: ARCA South, 7th Ave, Taguig, 1630 Metro Manila, 菲律宾 ",http://www.facebook.com/sheedesigninteriorsph,电话: +63 917 133 1993 ,,Interior Design Material Supplier,"BGC, Manila, Philippines",2026-03-20 17:23
Luxdezine,,,"地址: 36, The Uptown Palazzo, 4F 9th Ave, Taguig, 1634 Metro Manila, 菲律宾 ",https://luxdezine.com/,电话: +63 918 948 4230 ,,Interior Design Material Supplier,"BGC, Manila, Philippines",2026-03-20 17:23
MOs Design,,,"地址: B2, Bonifacio High Street 9th Ave, Taguig, 1634 Metro Manila, 菲律宾 ",https://mosdesign.com.ph/,电话: +63 2 8403 6620 ,Johndoe@gmail.com,Interior Design Material Supplier,"BGC, Manila, Philippines",2026-03-20 17:23
NITORI Mitsukoshi BGC,,,"地址: Third Floor, 8th Ave. Corner 36th St. Grand Central Park, North BGC Unit 0301-0303, Taguig, 1635 Kalakhang Maynila, 菲律宾 ",http://www.nitori.com.ph/,电话: +63 917 128 4193 ,nrv_ec-inquiry@nitori.com.ph,Interior Design Material Supplier,"BGC, Manila, Philippines",2026-03-20 17:24
