Name,Rating,Reviews,Address,Website,Phone,Email,关键词,区域,抓取时间
Integral Hotel Supplies company شركة المستلزمات المتكاملة للفنادق,,,"地址: Al Rajhi Village complex- Villa, Al Muayid Attaf, 22B As Salamah Jeddah SA 23525沙特阿拉伯 ",https://land.ihs-ksa.com/,电话: +966 9200 09269 ,,Hotel Renovation Supply Co,"Al Balad, Jeddah, Saudi Arabia",2026-03-20 17:39
Royal Host - (For Hotel and Restaurant's Equipments),,,"地址: Abu Thar Al-Ghifari, An Naseem, Jeddah 23236沙特阿拉伯 ",,电话: +966 12 252 2289 ,,Hotel Renovation Supply Co,"Al Balad, Jeddah, Saudi Arabia",2026-03-20 17:39
Rolaco Hospitality Supplies HSD,,,"地址: JLSA2567، 2567 الامير فيصل محمد سعود عبدالعزيز،, 6676،, Jeddah 21451沙特阿拉伯 ",http://www.rolaco.com.sa/,,,Hotel Renovation Supply Co,"Al Balad, Jeddah, Saudi Arabia",2026-03-20 17:39
Gentelle Hotel Supplies - Warehouse,,,"地址: طريق الملك فيصل, As Surooriyah, Jeddah 22523沙特阿拉伯 ",https://sa.gentelle.com/,电话: +966 53 719 0756 ,,Hotel Renovation Supply Co,"Al Balad, Jeddah, Saudi Arabia",2026-03-20 17:39
Al Balad Development Company,,,"地址: King Abdulaziz Branch Rd, Street, Jeddah 22233沙特阿拉伯 ",https://balad.com.sa/,,,Hotel Renovation Supply Co,"Al Balad, Jeddah, Saudi Arabia",2026-03-20 17:39
Hotel & Restaurant Supplies Expo,,,"地址: Qadat Al Fekr, Al-Ruwais, Jeddah 00966沙特阿拉伯 ",http://www.makkahexpo.net/,电话: +966 57 278 4058 ,,Hotel Renovation Supply Co,"Al Balad, Jeddah, Saudi Arabia",2026-03-20 17:39
