Name,Rating,Reviews,Address,Website,Phone,Email,关键词,区域,抓取时间
شركة نخبة المبتكرون المحدودة,,,"地址: Al Baghdadi, Al-Baghdadiyah Al-Gharbiyah, Jeddah, شارع الأمانة مقابل وزارة الثقافة والاعلام برج رجال الأعمال الدور التاسع, Jeddah 23443沙特阿拉伯 ",http://www.eicsaudi.com/,电话: +966 55 510 0967 ,info@eicsaudi.com,Interior Design Material Supplier,"Al Balad, Jeddah, Saudi Arabia",2026-03-20 17:40
MODASSIC Interior Design Studio,,,"地址: Dist, 8795 Buhur Al Shuaara St, Al Khalidiyyah, 2939, Jeddah 23422沙特阿拉伯 ",http://www.modassic.com/,电话: +966 56 819 7183 ,info@modassic.com,Interior Design Material Supplier,"Al Balad, Jeddah, Saudi Arabia",2026-03-20 17:40
ALBAYT DECOR SHOWROOM,,,"地址: Al Hamraa, Al-Hamra'a, Jeddah 23323沙特阿拉伯 ",http://www.albaytdecor.com/,电话: +966 55 540 3250 ,,Interior Design Material Supplier,"Al Balad, Jeddah, Saudi Arabia",2026-03-20 17:40
BU Design,,,"地址: Ar Rawdah, Jeddah 23432沙特阿拉伯 ",https://www.beyou-design.com/,电话: +966 12 261 9853 ,"605a7baede844d278b89dc95ae0a9123@sentry-next.wixpress.com, 2062d0a4929b45348643784b5cb39c36@sentry.wixpress.com, 8eb368c655b84e029ed79ad7a5c1718e@sentry.wixpress.com",Interior Design Material Supplier,"Al Balad, Jeddah, Saudi Arabia",2026-03-20 17:40
SK-Touch Interior Design Studio,,,"地址: 4343, Ar Rawdah, Jeddah 23432沙特阿拉伯 ",https://www.sk-touch.com/,电话: +966 50 564 4518 ,info@sk-touch.com,Interior Design Material Supplier,"Al Balad, Jeddah, Saudi Arabia",2026-03-20 17:40
الأرض الزرقاء للمقاولات والديكورات,,,"地址: Qouraish, As Salamah, Jeddah 62711沙特阿拉伯 ",https://www.blueland-sa.com/,电话: +966 55 917 1662 ,,Interior Design Material Supplier,"Al Balad, Jeddah, Saudi Arabia",2026-03-20 17:40
Modern Expertise for European Building Materials,,,"地址: 3077 Al Baladeah, Aziziyah, Jeddah 23334沙特阿拉伯 ",,电话: +966 55 635 7435 ,,Interior Design Material Supplier,"Al Balad, Jeddah, Saudi Arabia",2026-03-20 17:40
B Design,,,"地址: Prince Saud Al Faisal, Ar Rawdah, Jeddah 23434沙特阿拉伯 ",,电话: +966 9200 00374 ,,Interior Design Material Supplier,"Al Balad, Jeddah, Saudi Arabia",2026-03-20 17:40
Al Kayan Decor Co Ltd.,,,"地址: Hael, Al Hamra، Jeddah 23213沙特阿拉伯 ",http://www.alkayandecor.com/,电话: +966 55 930 3133 ,"sales@alkayndecor.com, info@alkayandecor.com, marketing@alkayandecor.com",Interior Design Material Supplier,"Al Balad, Jeddah, Saudi Arabia",2026-03-20 17:40
