Name,Rating,Reviews,Address,Website,Phone,Email,关键词,区域,抓取时间
SARA Showroom - Takhassusi,,,"地址: Al Takhassousi, Al Olaya, Riyadh 12333沙特阿拉伯 ",https://sa.saragrouponline.com/?selectedCoutry=KSA,电话: +966 11 463 2693 ,,Bathroom Renovation Specialist,"Olaya, Riyadh, Saudi Arabia",2026-03-27 13:29
Contractors Direct,,,"地址: District, Level 18, Faisaliah Tower, King Fahad Highway, Olaya, Riyadh 11524沙特阿拉伯 ",https://contractors.direct/ksa-en/,电话: +966 11 484 7148 ,info@contractors.direct,Bathroom Renovation Specialist,"Olaya, Riyadh, Saudi Arabia",2026-03-27 13:29
Architecture | Interior Design | Fit-Out | Rayfitout,,,"地址: Level 6, Gate D, Al Akaria Plaza, Main Street, Al Olaya, Riyadh 86334沙特阿拉伯 ",https://www.rayfitout.com/,电话: +966 800 891 2050 ,"PROCUREMENT@RAYFITOUT.COM, INFO@RAYFITOUT.COM, career@rayfitout.com",Bathroom Renovation Specialist,"Olaya, Riyadh, Saudi Arabia",2026-03-27 13:30
Amaze Al Arabia | Finishing Work | Fit-Out | Ray Fitout & Interior Decor,,,"地址: Ahmad Al Hawwari St, Al Murabba, Riyadh 12626沙特阿拉伯 ",https://amazearabia.com/,电话: +966 56 781 6142 ,info@amazearabia.com,Bathroom Renovation Specialist,"Olaya, Riyadh, Saudi Arabia",2026-03-27 13:30
Lucian,,,"地址: Al Takhassousi, Al Olaya, Riyadh 12331沙特阿拉伯 ",http://www.instagram.com/lucian.ksa/,电话: +966 55 507 6395 ,,Bathroom Renovation Specialist,"Olaya, Riyadh, Saudi Arabia",2026-03-27 13:30
Black Lacquer for Design / طلاء اسود للتصميم,,,"地址: Al Olaya, Riyadh 12333沙特阿拉伯 ",http://www.blacklacquer.sa/,电话: +966 50 678 0654 ,info@blacklacquer.co,Bathroom Renovation Specialist,"Olaya, Riyadh, Saudi Arabia",2026-03-27 13:30
Aseef Future General Contracting (AFG Contracting),,,"地址: Street Number 70, Musa Ibn Nusair Street Al Wasat Valley Street 12214沙特阿拉伯 ",http://www.afg-contracting.com/,电话: +966 54 816 5852 ,,Bathroom Renovation Specialist,"Olaya, Riyadh, Saudi Arabia",2026-03-27 13:30
First Saudi Contracting Company,,,"地址: 6356, Riyadh 12211沙特阿拉伯 ",https://www.saudifcc.com/,电话: +966 11 465 0858 ,"info@saudifcc.com, 605a7baede844d278b89dc95ae0a9123@sentry-next.wixpress.com, 8eb368c655b84e029ed79ad7a5c1718e@sentry.wixpress.com",Bathroom Renovation Specialist,"Olaya, Riyadh, Saudi Arabia",2026-03-27 13:30
Design & Art Construction co.,,,,https://designartconst.com/,电话: +966 54 840 0007 ,"5d1795a2db124a268f1e1bd88f503500@sentry.wixpress.com, 18d2f96d279149989b95faf0a4b41882@sentry-next.wixpress.com, 605a7baede844d278b89dc95ae0a9123@sentry-next.wixpress.com",Bathroom Renovation Specialist,"Olaya, Riyadh, Saudi Arabia",2026-03-27 13:30
