Name,Rating,Reviews,Address,Website,Phone,Email,关键词,区域,抓取时间
Baytonia بيتونيا,,,"地址: PMHC+X4, Al Wurud, Riyadh 12253沙特阿拉伯 ",https://baytonia.com/,,,Bathroom Furniture Showroom,"Olaya, Riyadh, Saudi Arabia",2026-03-27 13:28
SARA Showroom - Takhassusi,,,"地址: Al Takhassousi, Al Olaya, Riyadh 12333沙特阿拉伯 ",https://sa.saragrouponline.com/?selectedCoutry=KSA,电话: +966 11 463 2693 ,,Bathroom Furniture Showroom,"Olaya, Riyadh, Saudi Arabia",2026-03-27 13:28
Al Ghamdi Co. For Sanitarywares,,,"地址: Thakkhasossi Street, Al Olaya, Riyadh 12311沙特阿拉伯 ",http://www.amghamdi.com/,电话: +966 11 464 6279 ,"salesryd@amghamdi.com, 605a7baede844d278b89dc95ae0a9123@sentry-next.wixpress.com, salesjed@amghamdi.com",Bathroom Furniture Showroom,"Olaya, Riyadh, Saudi Arabia",2026-03-27 13:28
شركة محمد صالح باحارث - روكا Roca,,,"地址: Al Takhassousi, Al Mathar Ash Shamali, Riyadh 12332沙特阿拉伯 ",http://www.rocamsb.com/,电话: +966 11 488 9118 ,,Bathroom Furniture Showroom,"Olaya, Riyadh, Saudi Arabia",2026-03-27 13:28
"Oppolia Kitchens & interiors, اوبوليا مطابخ وديكورات داخلية",,,"地址: Al Takhassousi, Al Olaya, التخصصي, Riyadh 12331沙特阿拉伯 ",https://www.oppoliaksa.com/,电话: +966 54 060 4449 ,info@oppoliaksa.com,Bathroom Furniture Showroom,"Olaya, Riyadh, Saudi Arabia",2026-03-27 13:28
Ibrahim M. Alnajran - KOHLER,,,"地址: Al Mathar Ash Shamali، Saudi, Riyadh 12334沙特阿拉伯 ",http://www.imnajran.com/,电话: +966 11 488 3455 ,"info@imnajran.com, hoffice2@imnajran.com",Bathroom Furniture Showroom,"Olaya, Riyadh, Saudi Arabia",2026-03-27 13:29
