Name,Rating,Reviews,Address,Website,Phone,Email,关键词,区域,抓取时间
Aljehath Trading (شركة الجهات الأصلية للتجارة)(Original Entities Building Materials Trading Est.),,,"地址: Dhahran St, Al Malaz, Riyadh 12833沙特阿拉伯 ",https://aljehath.com/,电话: +966 56 306 7648 ,,Contractor Supply Outlet,"Olaya, Riyadh, Saudi Arabia",2026-03-27 13:28
المصعبي لمواد البناء والسباكة,,,"地址: Al Olaya, Riyadh 12313沙特阿拉伯 ",,电话: +966 11 293 5641 ,,Contractor Supply Outlet,"Olaya, Riyadh, Saudi Arabia",2026-03-27 13:29
ABCO Building Materials ابكو لمواد البناء,,,"地址: Ibn Majah, As Sulay, Riyadh 14323沙特阿拉伯 ",https://abcosaudi.com/,电话: +966 53 613 2392 ,,Contractor Supply Outlet,"Olaya, Riyadh, Saudi Arabia",2026-03-27 13:29
Saudi Ceramics | الخزف السعودي,,,"地址: Dis, King Fahad Rd Olaya, Riyadh 沙特阿拉伯 ",https://shop.saudiceramics.com/,,support@saudiceramics.com,Contractor Supply Outlet,"Olaya, Riyadh, Saudi Arabia",2026-03-27 13:29
Al Ghamdi Co. For Sanitarywares,,,"地址: Thakkhasossi Street, Al Olaya, Riyadh 12311沙特阿拉伯 ",http://www.amghamdi.com/,电话: +966 11 464 6279 ,"salesryd@amghamdi.com, 605a7baede844d278b89dc95ae0a9123@sentry-next.wixpress.com, salesjed@amghamdi.com",Contractor Supply Outlet,"Olaya, Riyadh, Saudi Arabia",2026-03-27 13:29
سباکةوكهرباء,,,"地址: Musa Ibn Nusair St, Al Olaya, Riyadh 12333沙特阿拉伯 ",,电话: +966 50 117 4126 ,,Contractor Supply Outlet,"Olaya, Riyadh, Saudi Arabia",2026-03-27 13:29
