Name,Rating,Reviews,Address,Website,Phone,Email,关键词,区域,抓取时间
Architecture | Interior Design | Fit-Out | Rayfitout,,,"地址: Level 6, Gate D, Al Akaria Plaza, Main Street, Al Olaya, Riyadh 86334沙特阿拉伯 ",https://www.rayfitout.com/,电话: +966 800 891 2050 ,"PROCUREMENT@RAYFITOUT.COM, INFO@RAYFITOUT.COM, career@rayfitout.com",Designer Bathroom Studio,"Olaya, Riyadh, Saudi Arabia",2026-03-27 13:29
Dezign District Saudi Arabia - Furniture Showroom & Collaborative Space,,,"地址: Olaya St, Al Olaya, Riyadh 12214沙特阿拉伯 ",https://dezigndistrict.com.sa/,电话: +966 55 367 0036 ,,Designer Bathroom Studio,"Olaya, Riyadh, Saudi Arabia",2026-03-27 13:29
Livspace - لفسبيس للتصميم الداخلي,,,"地址: Gate A2, second floor, office 205, King Fahad Road, Riyadh 沙特阿拉伯 ",https://www.livspace.com/sa-ar,电话: +966 11 510 7138 ,sacustomercare@livspace.com,Designer Bathroom Studio,"Olaya, Riyadh, Saudi Arabia",2026-03-27 13:30
Tdh Interior Design Studio تصميم داخلي,,,"地址: المروج،, almuruj QM42+WW5،, Riyadh 12264沙特阿拉伯 ",https://instagram.com/tdh.sa?igshid=1i19g0ff58znc,电话: +966 53 158 6774 ,,Designer Bathroom Studio,"Olaya, Riyadh, Saudi Arabia",2026-03-27 13:30
DSQUARE BY ARMADA,,,"地址: District, 7060 Al Takhassousi Street , Al Mohamadiyah, Riyadh 12362沙特阿拉伯 ",http://www.dsquareksa.com/,电话: +966 11 407 0607 ,dsquare@armada.com.sa,Designer Bathroom Studio,"Olaya, Riyadh, Saudi Arabia",2026-03-27 13:30
Boudl Olaya,,,"地址: MMRP+QP, As Sulimaniyah, Riyadh 12222沙特阿拉伯 ",,电话: +966 11 829 5900 ,,Designer Bathroom Studio,"Olaya, Riyadh, Saudi Arabia",2026-03-27 13:30
"Comelite Architecture, Structure and Interior Design",,,"地址: PM6C+6QQ, طريق الملك فهد،, Al Olaya, Riyadh 12333沙特阿拉伯 ",,电话: +966 53 300 4234 ,,Designer Bathroom Studio,"Olaya, Riyadh, Saudi Arabia",2026-03-27 13:30
