Name,Rating,Reviews,Address,Website,Phone,Email,关键词,区域,抓取时间
SACO,,,"地址: Al Takhassousi, Al Mathar Ash Shamali, Riyadh 12312沙特阿拉伯 ",http://saco.sa/,电话: +966 11 482 9230 ,,Home Improvement & Plumbing Supply,"Olaya, Riyadh, Saudi Arabia",2026-03-27 13:36
Aljehath Trading (شركة الجهات الأصلية للتجارة)(Original Entities Building Materials Trading Est.),,,"地址: Dhahran St, Al Malaz, Riyadh 12833沙特阿拉伯 ",https://aljehath.com/,电话: +966 56 306 7648 ,,Home Improvement & Plumbing Supply,"Olaya, Riyadh, Saudi Arabia",2026-03-27 13:36
Al Ghamdi Co. For Sanitarywares,,,"地址: Thakkhasossi Street, Al Olaya, Riyadh 12311沙特阿拉伯 ",http://www.amghamdi.com/,电话: +966 11 464 6279 ,"salesryd@amghamdi.com, 605a7baede844d278b89dc95ae0a9123@sentry-next.wixpress.com, salesjed@amghamdi.com",Home Improvement & Plumbing Supply,"Olaya, Riyadh, Saudi Arabia",2026-03-27 13:36
البيت الانيق الذهبي,,,"地址: QM3G+3P، 8616 طريق الملك عبدالعزيز، حي الملك فهد،، 3833،, Riyadh 12274沙特阿拉伯 ",https://albaytalaniq.com/,电话: +966 55 012 8859 ,,Home Improvement & Plumbing Supply,"Olaya, Riyadh, Saudi Arabia",2026-03-27 13:36
شركة صولة الفرسان للسباكة والكهرباء ومواد البناء سباكة,,,"地址: 7299 Al Takhassousi, Al Mathar Ash Shamali, 3178, Riyadh 12313沙特阿拉伯 ",,,,Home Improvement & Plumbing Supply,"Olaya, Riyadh, Saudi Arabia",2026-03-27 13:36
مؤسسة زهرة الربيع للكهرباء والسباكة,,,"地址: Al Takhassousi, Al Olaya, Riyadh 12313沙特阿拉伯 ",,电话: +966 11 464 4373 ,,Home Improvement & Plumbing Supply,"Olaya, Riyadh, Saudi Arabia",2026-03-27 13:36
