Name,Rating,Reviews,Address,Website,Phone,Email,关键词,区域,抓取时间
Al Ghamdi Co. For Sanitarywares,,,"地址: Thakkhasossi Street, Al Olaya, Riyadh 12311沙特阿拉伯 ",http://www.amghamdi.com/,电话: +966 11 464 6279 ,"salesryd@amghamdi.com, 605a7baede844d278b89dc95ae0a9123@sentry-next.wixpress.com, salesjed@amghamdi.com",Home Decor & Sanitary Ware Retailer,"Olaya, Riyadh, Saudi Arabia",2026-03-27 13:37
Hatch هاتش للأدوات الصحية شارع التخصصي,,,"地址: 6896 Al Takhassousi, Al Mathar Ash Shamali, Riyadh 12332沙特阿拉伯 ",https://hatch-products.com/sanitary-shower-accessories-toilet-seates-saudi-arabia/c1315545647,电话: +966 58 069 8210 ,,Home Decor & Sanitary Ware Retailer,"Olaya, Riyadh, Saudi Arabia",2026-03-27 13:37
Rest Room,,,"地址: 6941 Al Takhassousi، 6941 التخصصي، العليا، الرياض 12331 3629 3629, Riyadh 12331沙特阿拉伯 ",https://restroom.sa/,电话: +966 9200 28545 ,,Home Decor & Sanitary Ware Retailer,"Olaya, Riyadh, Saudi Arabia",2026-03-27 13:37
Saudi Ceramics | الخزف السعودي,,,"地址: Dis, King Fahad Rd Olaya, Riyadh 沙特阿拉伯 ",https://shop.saudiceramics.com/,,support@saudiceramics.com,Home Decor & Sanitary Ware Retailer,"Olaya, Riyadh, Saudi Arabia",2026-03-27 13:37
GROHE BY RICHERS | ريتشيرز للادوات الصحية,,,"地址: Al Takhassousi, Al Mathar Ash Shamali, Riyadh 12334沙特阿拉伯 ",https://evexl3d.com/tour/richers-35481/,电话: +966 55 030 3314 ,,Home Decor & Sanitary Ware Retailer,"Olaya, Riyadh, Saudi Arabia",2026-03-27 13:38
SARA Showroom - Takhassusi,,,"地址: Al Takhassousi, Al Olaya, Riyadh 12333沙特阿拉伯 ",https://sa.saragrouponline.com/?selectedCoutry=KSA,电话: +966 11 463 2693 ,,Home Decor & Sanitary Ware Retailer,"Olaya, Riyadh, Saudi Arabia",2026-03-27 13:38
