Name,Rating,Reviews,Address,Website,Phone,Email,关键词,区域,抓取时间
Black Box - الصندوق الأسود,,,"地址: قريب من, Prince Muhammad Ibn Abd Al Aziz, Al Olaya، طريق الملك فهد, Riyadh 11666沙特阿拉伯 ",https://blackbox.com.sa/,电话: +966 800 302 2200 ,online@blackbox.com.sa,Home Electronics Retailer,"Olaya, Riyadh, Saudi Arabia",2026-03-27 13:40
Jarir Bookstore,,,"地址: Olaya St, Al Olaya, Riyadh 12213沙特阿拉伯 ",https://www.jarir.com/,电话: +966 9200 00089 ,"care@jarir.com, u003Ecare@jarir.com",Home Electronics Retailer,"Olaya, Riyadh, Saudi Arabia",2026-03-27 13:41
Aflak Electronic Industris Co شركة أفلاك للصناعات الإلكترونية,,,"地址: 2864 Prince Sultan Bin Abdulaziz Rd, 7326, Al Olaya, Riyadh 12222沙特阿拉伯 ",http://aflak.com.sa/,电话: +966 11 465 7722 ,"supportr@aflak.com.sa, supportj@aflak.com.sa, sales@aflak.com.sa",Home Electronics Retailer,"Olaya, Riyadh, Saudi Arabia",2026-03-27 13:41
Electron Tech,,,"地址: No. 12, Wadi Al Jarir, Riyadh 12211沙特阿拉伯 ",http://www.electroon.com/,电话: +966 9200 07276 ,"orders@electroon.com, sales@electroon.com",Home Electronics Retailer,"Olaya, Riyadh, Saudi Arabia",2026-03-27 13:41
Rowad Electronics,,,"地址: Anas Ibn Malik Rd, Alyasmin, Riyadh 14813沙特阿拉伯 ",http://rowadshop.com/,电话: +966 55 681 5220 ,info@rowadshop.com,Home Electronics Retailer,"Olaya, Riyadh, Saudi Arabia",2026-03-27 13:41
Laptop World ‎,,,"地址: Street 8, Al Olaya, Riyadh 12211沙特阿拉伯 ",,电话: +966 50 777 7120 ,,Home Electronics Retailer,"Olaya, Riyadh, Saudi Arabia",2026-03-27 13:41
