Name,Rating,Reviews,Address,Website,Phone,Email,关键词,区域,抓取时间
SACO World,,,"地址: King Abdullah Branch Rd, King Fahd, Riyadh 12272沙特阿拉伯 ",http://saco.sa/,电话: +966 11 456 5566 ,,Home Improvement Center,"Olaya, Riyadh, Saudi Arabia",2026-03-27 13:28
Tavola - Thalatheen Street,,,"地址: Prince Sultan Bin Abdulaziz Rd, Thalatheen Street, Riyadh 沙特阿拉伯 ",https://www.tavolashop.com/sa-en/,电话: +966 11 416 3877 ,,Home Improvement Center,"Olaya, Riyadh, Saudi Arabia",2026-03-27 13:28
Crestwood kitchens,,,"地址: 11427 خيرالدين الرملي, Al Olaya, Riyadh 12331沙特阿拉伯 ",https://linktr.ee/crestwood_ksa,电话: +966 53 518 8853 ,,Home Improvement Center,"Olaya, Riyadh, Saudi Arabia",2026-03-27 13:28
Al Hazzaz World,,,"地址: PM7H+XM2, Al Urubah Rd, Al Olaya, Riyadh 12244沙特阿拉伯 ",,电话: +966 11 464 6263 ,,Home Improvement Center,"Olaya, Riyadh, Saudi Arabia",2026-03-27 13:28
Almoajil - Yale | شركة المعجل - يال,,,"地址: Al Mathar Ash Shamali, Takhassusi Street, Al maathat, Riyadh 沙特阿拉伯 ",http://hardware.almoajilholding.com/,电话: +966 11 488 4141 ,,Home Improvement Center,"Olaya, Riyadh, Saudi Arabia",2026-03-27 13:28
Panda Hyper 100 | بنده هايبر,,,"地址: شارع التخصصي، حي المعذر الشمالي،, Riyadh 12312沙特阿拉伯 ",http://www.panda.com.sa/,电话: +966 9200 27707 ,,Home Improvement Center,"Olaya, Riyadh, Saudi Arabia",2026-03-27 13:29
