Name,Rating,Reviews,Address,Website,Phone,Email,关键词,区域,抓取时间
Horizon Design and Contracting,,,"地址: Office No 6, 21 Prince Sultan Bin Abdulaziz Rd, Al Olaya, Riyadh 12221沙特阿拉伯 ",http://www.horizon.design/,电话: +966 11 216 0085 ,"user@domain.com, info@horizon.design",Interior Design & Contracting,"Olaya, Riyadh, Saudi Arabia",2026-03-27 13:41
Q Design Company (Architecture & Interior),,,"地址: 6th Floor, Al Faleh Center, Al Olaya Street, P.O. Box 301176 Riyadh 11372, KSA, Riyadh 沙特阿拉伯 ",http://www.qdesign.net/,电话: +966 11 464 0897 ,info@qdesign.net,Interior Design & Contracting,"Olaya, Riyadh, Saudi Arabia",2026-03-27 13:41
Sosak Contractors & Interior Designers,,,"地址: MMMP+R4M، District، 7084 King Fahd Road Al Olaya - 4214 Riyadh SA, Riyadh 12311沙特阿拉伯 ",http://www.a-sosak.com/,电话: +966 50 527 5074 ,info@a-sosak.com,Interior Design & Contracting,"Olaya, Riyadh, Saudi Arabia",2026-03-27 13:41
Architecture | Interior Design | Fit-Out | Rayfitout,,,"地址: Level 6, Gate D, Al Akaria Plaza, Main Street, Al Olaya, Riyadh 86334沙特阿拉伯 ",https://www.rayfitout.com/,电话: +966 800 891 2050 ,"PROCUREMENT@RAYFITOUT.COM, INFO@RAYFITOUT.COM, career@rayfitout.com",Interior Design & Contracting,"Olaya, Riyadh, Saudi Arabia",2026-03-27 13:41
MADAYA,,,"地址: Al Takhassousi، Office number 25, 3rd Floor, Tafaseel Center, Riyadh 12332沙特阿拉伯 ",http://www.madaya.com/,电话: +966 11 201 8800 ,"8eb368c655b84e029ed79ad7a5c1718e@sentry.wixpress.com, 605a7baede844d278b89dc95ae0a9123@sentry-next.wixpress.com, 88170cb0c9d64f94b5821ca7fd2d55a4@sentry-next.wixpress.com",Interior Design & Contracting,"Olaya, Riyadh, Saudi Arabia",2026-03-27 13:41
زوايا للتصميم الداخلي | ZAWAYA INTERIORS,,,"地址: Olaya St, Al Olaya, Riyadh 12211沙特阿拉伯 ",https://thezawaya.com/,电话: +966 9200 66700 ,,Interior Design & Contracting,"Olaya, Riyadh, Saudi Arabia",2026-03-27 13:42
Contractors Direct,,,"地址: District, Level 18, Faisaliah Tower, King Fahad Highway, Olaya, Riyadh 11524沙特阿拉伯 ",https://contractors.direct/ksa-en/,电话: +966 11 484 7148 ,info@contractors.direct,Interior Design & Contracting,"Olaya, Riyadh, Saudi Arabia",2026-03-27 13:42
SK-Touch Interior Design Studio,,,"地址: District, Noor center, Prince Sultan Bin Abdulaziz st Al Olaya, Riyadh 12211沙特阿拉伯 ",https://www.sk-touch.com/,电话: +966 50 564 4518 ,info@sk-touch.com,Interior Design & Contracting,"Olaya, Riyadh, Saudi Arabia",2026-03-27 13:42
Lotus Innovation Company | Design & Build,,,"地址: Al Olaya, Riyadh 12241沙特阿拉伯 ",http://lotus-const.com/,电话: +966 56 922 2268 ,info@lotus-const.com,Interior Design & Contracting,"Olaya, Riyadh, Saudi Arabia",2026-03-27 13:42
