Name,Rating,Reviews,Address,Website,Phone,Email,关键词,区域,抓取时间
Modern Expertise Co Ltd,,,"地址: Al Mathar Ash Shamali, Riyadh 12312沙特阿拉伯 ",,电话: +966 55 443 6131 ,,Modern Bathroom Gallery,"Olaya, Riyadh, Saudi Arabia",2026-03-27 13:41
"Oppolia Kitchens & interiors, اوبوليا مطابخ وديكورات داخلية",,,"地址: Al Takhassousi, Al Olaya, التخصصي, Riyadh 12331沙特阿拉伯 ",https://www.oppoliaksa.com/,电话: +966 54 060 4449 ,info@oppoliaksa.com,Modern Bathroom Gallery,"Olaya, Riyadh, Saudi Arabia",2026-03-27 13:41
Al Fadda Group,,,"地址: 74th Street, King Fahad branch road, Riyadh 沙特阿拉伯 ",http://www.alfaddagroup.com/,电话: +966 11 461 2333 ,info@alfaddagroup.com,Modern Bathroom Gallery,"Olaya, Riyadh, Saudi Arabia",2026-03-27 13:41
DSQUARE BY ARMADA,,,"地址: District, 7060 Al Takhassousi Street , Al Mohamadiyah, Riyadh 12362沙特阿拉伯 ",http://www.dsquareksa.com/,电话: +966 11 407 0607 ,dsquare@armada.com.sa,Modern Bathroom Gallery,"Olaya, Riyadh, Saudi Arabia",2026-03-27 13:41
ZARAHOME,,,"地址: District, 7060 Al Takhassousi Street , Al Mohamadiyah, Riyadh 12362沙特阿拉伯 ",http://www.dsquareksa.com/,电话: +966 11 407 0607 ,dsquare@armada.com.sa,Modern Bathroom Gallery,"Olaya, Riyadh, Saudi Arabia",2026-03-27 13:42
شركة امبينتا للتجارة Ambienta group ksa,,,"地址: Al Takhassousi, Al Olaya, Riyadh 12311沙特阿拉伯 ",https://www.ambienta-ksa.com/,电话: +966 55 897 7645 ,info.sa@ambientagroup.com,Modern Bathroom Gallery,"Olaya, Riyadh, Saudi Arabia",2026-03-27 13:42
