Name,Rating,Reviews,Address,Website,Phone,Email,关键词,区域,抓取时间
AINSPHERE Fit-out & Interior Solutions,,,"地址: StreeT, Al Imam Ali Ibn Abi Taleb, Al Malaz, Riyadh 12842沙特阿拉伯 ",https://www.ainsphereinteriors.com/,电话: +966 54 361 2700 ,,Residential Fit-out Specialist,"Olaya, Riyadh, Saudi Arabia",2026-03-27 13:42
Architecture | Interior Design | Fit-Out | Rayfitout,,,"地址: Level 6, Gate D, Al Akaria Plaza, Main Street, Al Olaya, Riyadh 86334沙特阿拉伯 ",https://www.rayfitout.com/,电话: +966 800 891 2050 ,"PROCUREMENT@RAYFITOUT.COM, INFO@RAYFITOUT.COM, career@rayfitout.com",Residential Fit-out Specialist,"Olaya, Riyadh, Saudi Arabia",2026-03-27 13:43
Contractors Direct,,,"地址: District, Level 18, Faisaliah Tower, King Fahad Highway, Olaya, Riyadh 11524沙特阿拉伯 ",https://contractors.direct/ksa-en/,电话: +966 11 484 7148 ,info@contractors.direct,Residential Fit-out Specialist,"Olaya, Riyadh, Saudi Arabia",2026-03-27 13:43
Amaze Al Arabia | Finishing Work | Fit-Out | Ray Fitout & Interior Decor,,,"地址: Ahmad Al Hawwari St, Al Murabba, Riyadh 12626沙特阿拉伯 ",https://amazearabia.com/,电话: +966 56 781 6142 ,info@amazearabia.com,Residential Fit-out Specialist,"Olaya, Riyadh, Saudi Arabia",2026-03-27 13:43
Vater -Office Fit Out & Interior design company Riyadh,,,"地址: Turki Al-Awwal Street, Al Muhammadiyah District, King Saud University, Building No. 6783, Second Floor, Riyadh 12362沙特阿拉伯 ",https://www.vater.sa/riyadh.php,电话: +966 53 968 8825 ,"sales@vater.sa, info@vater.sa, info@vater.qa",Residential Fit-out Specialist,"Olaya, Riyadh, Saudi Arabia",2026-03-27 13:43
Construction and FIT-OUT Solution,,,,http://www.ryzer-plus.com/,电话: +966 55 788 5351 ,,Residential Fit-out Specialist,"Olaya, Riyadh, Saudi Arabia",2026-03-27 13:43
Saudi Icon Company,,,"地址: Hammad Tower, King Fahd Branch Rd, Al Olaya, Riyadh 12584, Riyadh 12223沙特阿拉伯 ",http://www.saudi-icon.com/,电话: +966 11 461 3900 ,,Residential Fit-out Specialist,"Olaya, Riyadh, Saudi Arabia",2026-03-27 13:43
Innovative Interior Fitout Contracting Company,,,,https://www.saudiifco.com/,电话: +966 53 779 5808 ,"contact@saudiifco.com, saudiifco@gmail.com",Residential Fit-out Specialist,"Olaya, Riyadh, Saudi Arabia",2026-03-27 13:43
ATLANTIS Contracting - Interior Design and Fit-out works,,,"地址: 2433 Al Madina Al Munawwarah Rd, Al Faisaliyyah, Riyadh 12881沙特阿拉伯 ",https://atlantis.sa/,电话: +966 53 787 8794 ,,Residential Fit-out Specialist,"Olaya, Riyadh, Saudi Arabia",2026-03-27 13:43
