Name,Rating,Reviews,Address,Website,Phone,Email,关键词,区域,抓取时间
Riyadh Villas Contracting Co.,,,"地址: 2nd Floor, Tower #2, Main Street, Al Olaya, Al Mousa Centre, Riyadh 12271沙特阿拉伯 ",https://www.riyadh-villas.com/,电话: +966 55 502 7436 ,rvce@rvce.com.sa,Villa construction company,"Olaya, Riyadh, Saudi Arabia",2026-03-27 13:34
Construction & Planning Co. Ltd. (C&P ),,,"地址: Al Faisaliah Tower, King Fahd Rd, Al Olaya, Riyadh 12212沙特阿拉伯 ",http://www.candpco.com/,电话: +966 11 273 1214 ,"info@candpco.com, tendering@candpco.com",Villa construction company,"Olaya, Riyadh, Saudi Arabia",2026-03-27 13:34
Arabian Construction Company,,,"地址: North building, 6th floor, Sky Tower, Riyadh 12214沙特阿拉伯 ",https://www.accsal.com/,电话: +966 50 097 5200 ,"careers@accgroup.com, enquiry@accgroup.com",Villa construction company,"Olaya, Riyadh, Saudi Arabia",2026-03-27 13:35
Mid Arabia Contracting Co.(Head Office),,,"地址: 5th floor, babtain complex, olaya 9078, Riyadh 12221沙特阿拉伯 ",http://www.mid-contracting.com/,电话: +966 11 512 4159 ,mid@midcontracting.com,Villa construction company,"Olaya, Riyadh, Saudi Arabia",2026-03-27 13:35
Saudi Lebanese Contracting LTD. (SLC) الشركة السعودية اللبنانية للمقاولات,,,"地址: Olaya Main Street، Rosayis Commercial Center, Riyadh 沙特阿拉伯 ",http://saudilebanese.com/,电话: +966 11 293 0555 ext. 300 ,,Villa construction company,"Olaya, Riyadh, Saudi Arabia",2026-03-27 13:35
German Technical Services Co.,,,"地址: Building#93, Floor#1, Office#2, Riyadh Al Olaya District, Abdullah Bin Sulaiman Al Hamdan St, Riyadh 沙特阿拉伯 ",http://www.gts.sa/,电话: +966 11 293 5323 ,"info@gts.sa, business@gts.sa",Villa construction company,"Olaya, Riyadh, Saudi Arabia",2026-03-27 13:35
MACC - Modern Architecture Contracting Company,,,"地址: PM4G+G6X, King Fahd Branch Rd, Al Olaya, Riyadh 12214沙特阿拉伯 ",http://macc-ltd.com/I%20am%20MD%20Ali%20Khan%20manpower%20supplier,电话: +966 11 466 4423 ,info@macc-ltd.com,Villa construction company,"Olaya, Riyadh, Saudi Arabia",2026-03-27 13:35
Al Rashid Trading & Contracting Co.,,,"地址: Al Rashid Tower, King Saud Rd, As Sulimaniyah, Riyadh 11411沙特阿拉伯 ",http://www.rtcc.com.sa/,电话: +966 11 416 4111 ,info@rtcc.com.sa,Villa construction company,"Olaya, Riyadh, Saudi Arabia",2026-03-27 13:35
Home Construction,,,"地址: Prince Abdulaziz Ibn Musaid Ibn Jalawi St، الضباب، الامير, Riyadh 沙特阿拉伯 ",http://www.homeconstructionco.com/,电话: +966 11 462 6340 ,,Villa construction company,"Olaya, Riyadh, Saudi Arabia",2026-03-27 13:36
