Name,Rating,Reviews,Address,Website,Phone,Email,关键词,区域,抓取时间
บางกอกเซรามิค จํากัด,,,"地址: 1033 1 Phahonyothin Rd, Phaya Thai, Bangkok 10400泰国 ",http://www.bangkokceramic.co.th/,电话: +66 2 619 6200 ,bangkokceramic@gmail.com,Sanitary Ware Distributor,"Sukhumvit, Bangkok, Thailand",2026-03-20 15:11
"Kohler (Thailand) Public Co., Ltd.",,,"地址: ชั้น 16 อาคารจัสมิน ซิตี้ 2 ซอยสุขุมวิท 23, Sukhumvit Rd, Khlong Toei Nuea, Watthana, Bangkok 10110泰国 ",http://www.kohler.co.th/,电话: +66 2 700 9299 ,,Sanitary Ware Distributor,"Sukhumvit, Bangkok, Thailand",2026-03-20 15:11
Keratiles Ceramic กระเบื้องสระว่ายน้ำและตกแต่ง,,,"地址: 238 25 Soi Ratchadaphisek 18, Khwaeng Huai Khwang, Huai Khwang, Bangkok 10310泰国 ",https://www.keratiles.com/,电话: +66 84 752 9609 ,info@keratiles.co.th,Sanitary Ware Distributor,"Sukhumvit, Bangkok, Thailand",2026-03-20 15:11
Rayong Home Ceramics,,,"地址: 29, 3 ถนนบายพาส 36, Thap Ma, Mueang Rayong District, Rayong 21000泰国 ",http://www.homeceramic.com/,电话: +66 38 688 444 ,"rayonghomeceramic@gmail.com, Rayonghomeceramic@gmail.com",Sanitary Ware Distributor,"Sukhumvit, Bangkok, Thailand",2026-03-20 15:12
"Siam Sanitaryware Industry Co., Ltd.",,,"地址: 36 11 Vibhavadi Rangsit Rd, Sanam Bin, Don Mueang, Bangkok 10210泰国 ",,电话: +66 2 521 7777 ,,Sanitary Ware Distributor,"Sukhumvit, Bangkok, Thailand",2026-03-20 15:12
Nasco Sanitaryware (Thailand) Company Limited,,,"地址: 141 Khlong Maduea, Krathum Baen District, Samut Sakhon 74110泰国 ",https://www.nasco.co.th/,电话: +66 34 472 162 ,nascomarketings@gmail.com,Sanitary Ware Distributor,"Sukhumvit, Bangkok, Thailand",2026-03-20 15:12
